id,created_at,source,original_text,clean_text,sentiment,polarity,subjectivity,lang,favorite_count,retweet_count,original_author,possibly_sensitive,hashtags,user_mentions,place,place_coord_boundaries1243841366964056068,Sat Mar 28 10:04:25 +0000 2020,"<a href=""http://twitter.com/download/iphone"" rel=""nofollow"">Twitter for iPhone</a>",RT @ANI: Isolation coaches have been prepared by the Indian Railways to fight the #Coronavirus Pandemic. https://t.co/41T9Q71Zdr,Isolation coaches prepared Indian Railways fight Pandemic,"Sentiment(polarity=0.0, subjectivity=0.0)",0.0,0.0,en,0,2,prakashkhush,False,Coronavirus,ANI,,
1243841362765606912,Sat Mar 28 10:04:24 +0000 2020,"<a href=""https://mobile.twitter.com"" rel=""nofollow"">Twitter Web App</a>",RT @ANI: Isolation coaches have been prepared by the Indian Railways to fight the #Coronavirus Pandemic. https://t.co/41T9Q71Zdr,Isolation coaches prepared Indian Railways fight Pandemic,"Sentiment(polarity=0.0, subjectivity=0.0)",0.0,0.0,en,0,2037,Reechamishra2,False,Coronavirus,ANI,,
1243841358579679234,Sat Mar 28 10:04:23 +0000 2020,"<a href=""http://twitter.com/download/android"" rel=""nofollow"">Twitter for Android</a>",RT @SwarajyaMag: US-based healthcare technology maker Abbott has unveiled a Covid-19 test that can deliver positive results in as little as…,US-based healthcare technology maker Abbott unveiled Covid-19 test deliver positive results little as…,"Sentiment(polarity=0.019886363636363633, subjectivity=0.5227272727272727)",0.019886363636363633,0.5227272727272727,en,0,230393,ambi4giveup,,,SwarajyaMag,,
1243841354372804609,Sat Mar 28 10:04:22 +0000 2020,"<a href=""http://twitter.com/download/android"" rel=""nofollow"">Twitter for Android</a>","RT @PiyushGoyal: Preparing to Combat Coronavirus: In a novel initiative, Railways has converted train coaches into isolation wards for COVI…",Preparing Combat Coronavirus In novel initiative Railways converted train coaches isolation wards COVI…,"Sentiment(polarity=0.0, subjectivity=0.0)",0.0,0.0,en,0,96,Palak30504317,,,PiyushGoyal,"Maharashtra, India",
1243841350144946178,Sat Mar 28 10:04:21 +0000 2020,"<a href=""https://mobile.twitter.com"" rel=""nofollow"">Twitter Web App</a>","(3/3) Asia &amp; Pacific, Europe, Middle East/Africa, &amp; Americas; of which 140 are DOH IHR verified, 35 are new cases,… https://t.co/5MoZ0KlLp9",3/3 Asia amp Pacific Europe Middle East/Africa amp Americas DOH IHR verified new cases …,"Sentiment(polarity=0.06818181818181818, subjectivity=0.22727272727272727)",0.06818181818181818,0.22727272727272727,en,0,59,DFAPHL,False,,,Republic of the Philippines,
1243841345988378626,Sat Mar 28 10:04:20 +0000 2020,"<a href=""https://mobile.twitter.com"" rel=""nofollow"">Twitter Web App</a>","RT @The_NewArab: In-depth - 'Kashmir is bracing for disastrous consequences if the Covid-19 pandemic spreads, with residents in the dispute…",In-depth 'Kashmir bracing disastrous consequences Covid-19 pandemic spreads residents dispute…,"Sentiment(polarity=-0.7, subjectivity=0.8)",-0.7,0.8,en,0,63,wavetop,,,The_NewArab,Vancouver,
1243841341613690880,Sat Mar 28 10:04:19 +0000 2020,"<a href=""http://twitter.com/download/android"" rel=""nofollow"">Twitter for Android</a>",RT @zawirrahim: Another episode of patient and family not being honest on telling history of attending an event associated with COVID-19 ou…,Another episode patient family honest telling history attending event associated COVID-19 ou…,"Sentiment(polarity=0.6, subjectivity=0.9)",0.6,0.9,en,0,85,afifah_juhaideh,,,zawirrahim,Serendah - Kota Samarahan - KL,
1243841337604149251,Sat Mar 28 10:04:18 +0000 2020,"<a href=""http://twitter.com/download/iphone"" rel=""nofollow"">Twitter for iPhone</a>","RT @thalassaemiaTIF: Be a #BloodDonor, be a Hero - A real one! 🦸‍♀️🦸🏾🩸

Discover many useful resources for #COVID19 and all TIF's related s…",Be Hero A real one 🦸‍️🦸🩸 Discover many useful resources TIF 's related s…,"Sentiment(polarity=0.25, subjectivity=0.30000000000000004)",0.25,0.30000000000000004,en,0,1155,Thalassaemiapk,,"BloodDonor, COVID19",thalassaemiaTIF,"Lahore, Pakistan",
1243841333204152321,Sat Mar 28 10:04:17 +0000 2020,"<a href=""http://twitter.com/download/android"" rel=""nofollow"">Twitter for Android</a>","RT @moreki_mo: I swear we are fighting two pandemics 
Covid 19 and Stupidity",I swear fighting two pandemics Covid Stupidity,"Sentiment(polarity=-0.6, subjectivity=1.0)",-0.6,1.0,en,0,230387,MasksTim,,,moreki_mo,24| she/her | 🇲🇾 | ENG/BM,
1243841329076961280,Sat Mar 28 10:04:16 +0000 2020,"<a href=""https://mobile.twitter.com"" rel=""nofollow"">Twitter Web App</a>","Good news, We're ready to launch, but we're not #Opening now. 
The entire world is fighting with #Coronavirus.
In t… https://t.co/aJfIJZN9MO",Good news We 're ready launch 're The entire world fighting In t…,"Sentiment(polarity=0.3, subjectivity=0.5750000000000001)",0.3,0.5750000000000001,en,0,27,mitrandadhaba_,False,"Opening, Coronavirus",,"Black Town Sydney, Australia",
1243841324874424320,Sat Mar 28 10:04:15 +0000 2020,"<a href=""http://twitter.com/download/android"" rel=""nofollow"">Twitter for Android</a>",Keeping our fingers crossed that Covid-19 won't stop our wedding and our first dance to our fave @joestilgoe record… https://t.co/q9ADIc3tJN,Keeping fingers crossed Covid-19 wo n't stop wedding first dance fave record…,"Sentiment(polarity=0.25, subjectivity=0.3333333333333333)",0.25,0.3333333333333333,en,0,90,ZahavaLever,,,joestilgoe,,
1243841320789004289,Sat Mar 28 10:04:14 +0000 2020,"<a href=""http://twitter.com/download/android"" rel=""nofollow"">Twitter for Android</a>","Look I got a feckin pen with COVID-19 in it
#thisisnotsocialdistancing https://t.co/H8tt6JbVL6",Look I got feckin pen COVID-19,"Sentiment(polarity=0.0, subjectivity=0.0)",0.0,0.0,en,0,12,Ouly,False,thisisnotsocialdistancing,,"Waterloo, On",
1243841316586426369,Sat Mar 28 10:04:13 +0000 2020,"<a href=""http://twitter.com/download/iphone"" rel=""nofollow"">Twitter for iPhone</a>","RT @ChicagoTraderrr: I lost my Dad this morning to COVID-19. He was my rock, my best friend, and my hero. He had virtually no symptoms and…",I lost Dad morning COVID-19 He rock best friend hero He virtually symptoms and…,"Sentiment(polarity=1.0, subjectivity=0.3)",1.0,0.3,en,0,441,safiyaahmedx,,,ChicagoTraderrr,London/Newcastle/Dewsbury,
1243841312375308288,Sat Mar 28 10:04:12 +0000 2020,"<a href=""http://twitter.com/download/android"" rel=""nofollow"">Twitter for Android</a>","RT @jessbrammar: After 18-hour shifts trying to save our lives from COVID-19, NHS Hospital Staff are faced with canteens that shut at 5pm.…",After -hour shifts trying save lives COVID-19 NHS Hospital Staff faced canteens shut pm.…,"Sentiment(polarity=0.0, subjectivity=0.0)",0.0,0.0,en,0,6,vg123e,,,jessbrammar,,
1243841308235649025,Sat Mar 28 10:04:11 +0000 2020,"<a href=""http://twitter.com/download/android"" rel=""nofollow"">Twitter for Android</a>",RT @allontheboard: Isolation Observations: Number 1. Take a break from looking at the news and focus on taking care of yourself. @allontheb…,Isolation Observations Number Take break looking news focus taking care …,"Sentiment(polarity=0.0, subjectivity=0.0)",0.0,0.0,en,0,2227,rebeccapragnell,,,allontheboard,"South East, England",
1243841303823167488,Sat Mar 28 10:04:10 +0000 2020,"<a href=""http://twitter.com/download/iphone"" rel=""nofollow"">Twitter for iPhone</a>","RT @ChicagoTraderrr: I lost my Dad this morning to COVID-19. He was my rock, my best friend, and my hero. He had virtually no symptoms and…",I lost Dad morning COVID-19 He rock best friend hero He virtually symptoms and…,"Sentiment(polarity=1.0, subjectivity=0.3)",1.0,0.3,en,0,69,KaelaAmer1,,,ChicagoTraderrr,,
1243841299805061122,Sat Mar 28 10:04:09 +0000 2020,"<a href=""http://twitter.com/download/iphone"" rel=""nofollow"">Twitter for iPhone</a>","RT @StevieBrexit: Nazifa Zaman, chair of the University of Warwick Labour Society, celebrated Boris being tested positive for #coronavirus…",Nazifa Zaman chair University Warwick Labour Society celebrated Boris tested positive …,"Sentiment(polarity=0.28863636363636364, subjectivity=0.6477272727272727)",0.28863636363636364,0.6477272727272727,en,0,231897,PhilipRead1,,coronavirus,StevieBrexit,England,
1243841295577001985,Sat Mar 28 10:04:08 +0000 2020,"<a href=""http://twitter.com/download/android"" rel=""nofollow"">Twitter for Android</a>","RT @joshrogin: Wuhan reported only about 2,500 #coronavirus deaths, but 5,000 urns were delivered to one mortuary over just 2 days. “Wuhan…","Wuhan reported ,500 deaths ,000 urns delivered one mortuary days “ Wuhan…","Sentiment(polarity=0.0, subjectivity=0.0)",0.0,0.0,en,0,5616,max_indra_007,,coronavirus,joshrogin,,
1243841291437232128,Sat Mar 28 10:04:07 +0000 2020,"<a href=""http://twitter.com/download/iphone"" rel=""nofollow"">Twitter for iPhone</a>","RT @ChicagoTraderrr: I lost my Dad this morning to COVID-19. He was my rock, my best friend, and my hero. He had virtually no symptoms and…",I lost Dad morning COVID-19 He rock best friend hero He virtually symptoms and…,"Sentiment(polarity=1.0, subjectivity=0.3)",1.0,0.3,en,0,125,flwdss,,,ChicagoTraderrr,"Dubai, United Arab Emirates",
1243841287230554113,Sat Mar 28 10:04:06 +0000 2020,"<a href=""http://twitter.com/download/android"" rel=""nofollow"">Twitter for Android</a>",@Nwidadah Nigeria Covid-19 headquarters 😂,Nigeria Covid-19 headquarters,"Sentiment(polarity=0.0, subjectivity=0.0)",0.0,0.0,en,0,2414,IamErujeje,,,Nwidadah,,
1243841283048652801,Sat Mar 28 10:04:05 +0000 2020,"<a href=""http://twitter.com/download/iphone"" rel=""nofollow"">Twitter for iPhone</a>","RT @KenRoth: Hong Kong's protests have had to pause because of the coronavirus but support for their pro-democracy aims has grown, driven i…",Hong Kong 's protests pause coronavirus support pro-democracy aims grown driven i…,"Sentiment(polarity=0.0, subjectivity=0.0)",0.0,0.0,en,0,81026,freehkhoward,,,KenRoth,,
1243841278560919554,Sat Mar 28 10:04:04 +0000 2020,"<a href=""http://twitter.com/#!/download/ipad"" rel=""nofollow"">Twitter for iPad</a>",RT @bmj_latest: Could the introduction of emergency public health measures help reduce the burden of non-covid-19 related disease on the NH…,Could introduction emergency public health measures help reduce burden non-covid-19 related disease NH…,"Sentiment(polarity=0.0, subjectivity=0.23333333333333334)",0.0,0.23333333333333334,en,0,37,Brontezmum,,,bmj_latest,Preston UK,
1243841274647580672,Sat Mar 28 10:04:03 +0000 2020,"<a href=""http://twitter.com/download/android"" rel=""nofollow"">Twitter for Android</a>",RT @cindylcourtney: I am an NHS nurse and not social media savvy - I only have 106 followers &amp; I’m OK with that. I want to show how Covid-1…,I NHS nurse social media savvy I followers amp I ’ OK I want show Covid-1…,"Sentiment(polarity=0.26666666666666666, subjectivity=0.2833333333333333)",0.26666666666666666,0.2833333333333333,en,0,4,Feastforthynee1,,,cindylcourtney,,
1243841270503493633,Sat Mar 28 10:04:02 +0000 2020,"<a href=""https://dlvrit.com/"" rel=""nofollow"">dlvr.it</a>","New article: Covert coronavirus, chaos prize and the cost of contact-tracing. https://t.co/r7axuA4DIi #coronavirus #COVID19 #2019ncov",New article Covert coronavirus chaos prize cost contact-tracing,"Sentiment(polarity=0.13636363636363635, subjectivity=0.45454545454545453)",0.13636363636363635,0.45454545454545453,en,0,40,PaperbirdsH,False,"coronavirus, COVID19, 2019ncov",,,
1243841266217091072,Sat Mar 28 10:04:01 +0000 2020,"<a href=""http://twitter.com/download/iphone"" rel=""nofollow"">Twitter for iPhone</a>","RT @RepJoeKennedy: To repeat: a kid died of COVID-19 because he was uninsured.

We need immediate universal health care.",To repeat kid died COVID-19 uninsured We need immediate universal health care,"Sentiment(polarity=0.0, subjectivity=0.0)",0.0,0.0,en,0,75,realdebfarmer,,,RepJoeKennedy,"West Hollywood, CA",
1243841261884375040,Sat Mar 28 10:04:00 +0000 2020,"<a href=""https://mobile.twitter.com"" rel=""nofollow"">Twitter Web App</a>","RT @moreki_mo: I swear we are fighting two pandemics 
Covid 19 and Stupidity",I swear fighting two pandemics Covid Stupidity,"Sentiment(polarity=-0.6, subjectivity=1.0)",-0.6,1.0,en,0,29,IanW306,,,moreki_mo,"Hyde, Greater Manchester",
1243841257656315904,Sat Mar 28 10:03:59 +0000 2020,"<a href=""http://twitter.com/#!/download/ipad"" rel=""nofollow"">Twitter for iPad</a>","RT @AndyBiotech: #COVID19 best news of the day

FDA authorizes the fastest available point-of-care #coronavirus test, delivering positive r…",best news day FDA authorizes fastest available point-of-care test delivering positive r…,"Sentiment(polarity=0.5424242424242424, subjectivity=0.4151515151515151)",0.5424242424242424,0.4151515151515151,en,0,0,DavidLevinPhoto,,"COVID19, coronavirus",AndyBiotech,"Carlsbad, CA",
1243841253730447361,Sat Mar 28 10:03:58 +0000 2020,"<a href=""http://twitter.com/download/android"" rel=""nofollow"">Twitter for Android</a>",RT @manilabulletin: LOOK: SM City Legazpi will provide express lane to all medical practitioners and allied health workers for them to have…,LOOK SM City Legazpi provide eress lane medical practitioners allied health workers have…,"Sentiment(polarity=0.0, subjectivity=0.0)",0.0,0.0,en,0,13,BlackPinkStan00,,,manilabulletin,,
1243841249452232705,Sat Mar 28 10:03:57 +0000 2020,"<a href=""http://twitter.com/download/iphone"" rel=""nofollow"">Twitter for iPhone</a>","RT @manilabulletin: BREAKING: The country now has 1,075 confirmed cases of COVID-19. Death toll now at 68. Total number of recoveries at 35…","BREAKING The country ,075 confirmed cases COVID-19 Death toll Total number recoveries …","Sentiment(polarity=0.2, subjectivity=0.875)",0.2,0.875,en,0,122,sophiadevegaa,,,manilabulletin,syd,
1243841245316874240,Sat Mar 28 10:03:56 +0000 2020,"<a href=""http://twitter.com/download/iphone"" rel=""nofollow"">Twitter for iPhone</a>",RT @mgudesblatt: Not enough personal protective equipment for nurses/nurse assistants/physicians. My father is a neurologist in NY called t…,Not enough personal protective equipment nurses/nurse assistants/physicians My father neurologist NY called t…,"Sentiment(polarity=0.0, subjectivity=0.4)",0.0,0.4,en,0,807,frangluna,,,mgudesblatt,"ODB la Llana, Andaluçía.🔻💚",
1243841241118396416,Sat Mar 28 10:03:55 +0000 2020,"<a href=""http://twitter.com/#!/download/ipad"" rel=""nofollow"">Twitter for iPad</a>","RT @gmpfraud: ⚠️ Another Scam!!
DON'T  respond.
Do NOT click on links. 

#Cyberprotect #coronavirus https://t.co/pLIQeZG0lj",️ Another Scam DO N'T respond Do NOT click links,"Sentiment(polarity=0.0, subjectivity=0.0)",0.0,0.0,en,0,6420,RoytonCrompton,False,"Cyberprotect, coronavirus",gmpfraud,Blackshaw Lane Oldham,
1243841236890353664,Sat Mar 28 10:03:54 +0000 2020,"<a href=""https://mobile.twitter.com"" rel=""nofollow"">Twitter Web App</a>","RT @Pun_Starr: In a country where there aren't enough test kits for Covid-19, Kanika Kapoor has been tested thrice already.

Looks like som…",In country n't enough test kits Covid-19 Kanika Kapoor tested thrice already Looks like som…,"Sentiment(polarity=0.0, subjectivity=0.5)",0.0,0.5,en,0,240,a_mitgrover,,,Pun_Starr,Melbourne ,
1243841232524185600,Sat Mar 28 10:03:53 +0000 2020,"<a href=""http://twitter.com/#!/download/ipad"" rel=""nofollow"">Twitter for iPad</a>",Book News: Is the Covid-19 crisis a watershed moment for library e-books? https://t.co/OtUgBzyOs4,Book News Is Covid-19 crisis watershed moment library e-books,"Sentiment(polarity=0.0, subjectivity=0.0)",0.0,0.0,en,0,7,marseelee,False,,,"Nova Scotia, Canada",
1243841228321574912,Sat Mar 28 10:03:52 +0000 2020,"<a href=""http://twitter.com/download/iphone"" rel=""nofollow"">Twitter for iPhone</a>","RT @David_Leavitt: Countless Americans will die because of @realDonaldTrump’s incompetence.

Trump wants to erase the memory of him downpla…",Countless Americans die ’ incompetence Trump wants erase memory downpla…,"Sentiment(polarity=0.1, subjectivity=0.3)",0.1,0.3,en,0,1970,nel4172,,,"David_Leavitt, realDonaldTrump","Massachusetts, USA",
1243841224362070017,Sat Mar 28 10:03:51 +0000 2020,"<a href=""https://mobile.twitter.com"" rel=""nofollow"">Twitter Web App</a>",RT @SECNAV: Today #USNSMercy arrived @PortofLA to serve as a referral hospital for patients not infected with #COVID19 - handling overflow…,Today arrived serve referral hospital patients infected handling overflow…,"Sentiment(polarity=0.0, subjectivity=0.0)",0.0,0.0,en,0,13221,MaryMichienzi,,"USNSMercy, COVID19","SECNAV, PortofLA",,
1243841220146675713,Sat Mar 28 10:03:50 +0000 2020,"<a href=""https://mobile.twitter.com"" rel=""nofollow"">Twitter Web App</a>","RT @JuliaDavisNews: Russian state-media outlet Vesti described the course chosen by the Trump administration as “indecisive,” “poorly coord…",Russian state-media outlet Vesti described course chosen Trump administration “ indecisive ” “ poorly coord…,"Sentiment(polarity=-0.2, subjectivity=0.3)",-0.2,0.3,en,0,236,ustooenough,,,JuliaDavisNews,Michigan,
1243841215927398401,Sat Mar 28 10:03:49 +0000 2020,"<a href=""http://twitter.com/download/iphone"" rel=""nofollow"">Twitter for iPhone</a>","RT @ChicagoTraderrr: I lost my Dad this morning to COVID-19. He was my rock, my best friend, and my hero. He had virtually no symptoms and…",I lost Dad morning COVID-19 He rock best friend hero He virtually symptoms and…,"Sentiment(polarity=1.0, subjectivity=0.3)",1.0,0.3,en,0,0,victorious_02,,,ChicagoTraderrr,,
1243841211737178113,Sat Mar 28 10:03:48 +0000 2020,"<a href=""http://twitter.com"" rel=""nofollow"">Twitter Web Client</a>","RT @BostonDotCom: Ayanna Pressley announces she tested negative for COVID-19
https://t.co/up3QLoKu9J https://t.co/pmtgQ3r2bk",Ayanna Pressley announces tested negative COVID-19,"Sentiment(polarity=-0.3, subjectivity=0.4)",-0.3,0.4,en,0,34,eclecticbrotha,False,,BostonDotCom,Holdin BOFA on yo Mama's sofa,
1243841207522000896,Sat Mar 28 10:03:47 +0000 2020,"<a href=""http://twitter.com/download/android"" rel=""nofollow"">Twitter for Android</a>",RT @MAbdallaziz: @HarelimanaAK @AbdoulK74 @CityofKigali @bbcgahuza @FTwagiramungu @VictoireUmuhoza @vumbiu95 @IngabireIm @HassKaringanire L…,L…,"Sentiment(polarity=0.0, subjectivity=0.0)",0.0,0.0,en,0,6,HarelimanaAK,,,"MAbdallaziz, HarelimanaAK, AbdoulK74, CityofKigali, bbcgahuza, FTwagiramungu, VictoireUmuhoza, vumbiu95, IngabireIm, HassKaringanire",Kigali | Rwanda ,
1243841203080028161,Sat Mar 28 10:03:46 +0000 2020,"<a href=""http://twitter.com/download/android"" rel=""nofollow"">Twitter for Android</a>","RT @PiyushGoyal: Preparing to Combat Coronavirus: In a novel initiative, Railways has converted train coaches into isolation wards for COVI…",Preparing Combat Coronavirus In novel initiative Railways converted train coaches isolation wards COVI…,"Sentiment(polarity=0.0, subjectivity=0.0)",0.0,0.0,en,0,170,VasantgiriGosw3,,,PiyushGoyal,,
1243841199141765120,Sat Mar 28 10:03:45 +0000 2020,"<a href=""https://www.hootsuite.com"" rel=""nofollow"">Hootsuite Inc.</a>",HOPE- it's what we all need during these very challenging times. Please watch interview which Jim @FuhsionMktg &amp; I… https://t.co/2EUG6raORK,HOPE- 's need challenging times Please watch interview Jim amp I…,"Sentiment(polarity=0.5, subjectivity=1.0)",0.5,1.0,en,2,0,jeffsheehan,False,,FuhsionMktg,"Atlanta, GA",
1243841194809085952,Sat Mar 28 10:03:44 +0000 2020,"<a href=""http://twitter.com/download/iphone"" rel=""nofollow"">Twitter for iPhone</a>",RT @AnaCabrera: JUST IN: 51 Italian doctors who tested positive for #coronavirus have died - Italian Association of Doctors,JUST IN Italian doctors tested positive died Italian Association Doctors,"Sentiment(polarity=0.07575757575757576, subjectivity=0.1818181818181818)",0.07575757575757576,0.1818181818181818,en,0,81,kenn_tracey0492,,coronavirus,AnaCabrera,,
1243841190677680128,Sat Mar 28 10:03:43 +0000 2020,"<a href=""http://twitter.com/download/android"" rel=""nofollow"">Twitter for Android</a>",RT @HMRCgovuk: We have new guidance for VAT-registered businesses that want to defer payment of their next VAT return up to 30 June 2020. I…,We new guidance VAT-registered businesses want defer payment next VAT return June I…,"Sentiment(polarity=0.06818181818181818, subjectivity=0.22727272727272727)",0.06818181818181818,0.22727272727272727,en,0,13763,ChedzoyB,,,HMRCgovuk,taunton and london,
1243841186411859968,Sat Mar 28 10:03:42 +0000 2020,"<a href=""http://tapbots.com/tweetbot"" rel=""nofollow"">Tweetbot for iΟS</a>","RT @Laurie_Garrett: America has officially gone berserk.
Concern about #COVID19 is now partisan: Democrats fear the #pandemic, Republicans…",America officially gone berserk Concern partisan Democrats fear Republicans…,"Sentiment(polarity=0.0, subjectivity=0.0)",0.0,0.0,en,0,43805,bjchan,,"COVID19, pandemic",Laurie_Garrett,hong kong,
1243841182112907264,Sat Mar 28 10:03:41 +0000 2020,"<a href=""https://mobile.twitter.com"" rel=""nofollow"">Twitter Web App</a>","RT @Tesco: Some little helps for safer shopping from some of our wonderful Tesco colleagues. Because now more than ever, #EveryLittleHelps…",Some little helps safer shopping wonderful Tesco colleagues Because ever …,"Sentiment(polarity=0.40625, subjectivity=0.75)",0.40625,0.75,en,0,81,baxterontheloch,,EveryLittleHelps,Tesco,Garelochhead Sometimes......,
1243841178220593152,Sat Mar 28 10:03:40 +0000 2020,"<a href=""http://twitter.com/download/iphone"" rel=""nofollow"">Twitter for iPhone</a>",RT @brithume: NYC critical care physician just told Tucker Carlson that he’s been taking Plaquenil to help ward off Covid 19. So far he’s o…,NYC critical care physician told Tucker Carlson ’ taking Plaquenil help ward Covid So far ’ o…,"Sentiment(polarity=0.05, subjectivity=0.9)",0.05,0.9,en,0,15,srfryguy,,,brithume,"Nashville, TN",
1243841174038667264,Sat Mar 28 10:03:39 +0000 2020,"<a href=""https://mobile.twitter.com"" rel=""nofollow"">Twitter Web App</a>","(*#DavidAttenborough voice*)..""#COVID-19 is changing the world forever.The vast arid landscape, formerly known as t… https://t.co/IuuqRTIqe6",voice* .. '' -19 changing world forever.The vast arid landscape formerly known t…,"Sentiment(polarity=0.0, subjectivity=0.5)",0.0,0.5,en,0,39,elenilamont,,"DavidAttenborough, COVID",,Australia,
1243841169366192128,Sat Mar 28 10:03:38 +0000 2020,"<a href=""http://twitter.com/download/iphone"" rel=""nofollow"">Twitter for iPhone</a>","RT @moreki_mo: I swear we are fighting two pandemics 
Covid 19 and Stupidity",I swear fighting two pandemics Covid Stupidity,"Sentiment(polarity=-0.6, subjectivity=1.0)",-0.6,1.0,en,0,356,nrsyzwnish,,,moreki_mo,땡,
1243841165448712192,Sat Mar 28 10:03:37 +0000 2020,"<a href=""http://twitter.com/download/android"" rel=""nofollow"">Twitter for Android</a>","RT @gmanews: BREAKING: DOH reports 272 new COVID-19 cases, 14 new deaths, and 4 new recoveries.

This brings the totals to confirmed 1,075…","BREAKING DOH reports new COVID-19 cases new deaths new recoveries This brings totals confirmed ,075…","Sentiment(polarity=0.20227272727272727, subjectivity=0.5909090909090908)",0.20227272727272727,0.5909090909090908,en,0,0,nicolekatedf,,,gmanews,,
1243841161321680896,Sat Mar 28 10:03:36 +0000 2020,"<a href=""http://twitter.com/download/android"" rel=""nofollow"">Twitter for Android</a>","RT @sydney_talker: Good afternoon everyone.

I'm sharing my personal experience with our failed healthcare system especially on its inabili…",Good afternoon everyone I 'm sharing personal eerience failed healthcare system especially inabili…,"Sentiment(polarity=0.04999999999999999, subjectivity=0.55)",0.04999999999999999,0.55,en,0,22596,iam_tessybee,,,sydney_talker,Nigeria ,
1243841157181906944,Sat Mar 28 10:03:35 +0000 2020,"<a href=""http://twitter.com/download/android"" rel=""nofollow"">Twitter for Android</a>","RT @HealthcareWen: @stevenbodzin new data showing AIR is contaminated with #coronavirus:
https://t.co/H1vSebusIO

This is bad news because…",new data showing AIR contaminated This bad news because…,"Sentiment(polarity=-0.28181818181818175, subjectivity=0.5606060606060606)",-0.28181818181818175,0.5606060606060606,en,0,4352,rajni1959,False,coronavirus,"HealthcareWen, stevenbodzin","Leicester, UK",
1243841153000247296,Sat Mar 28 10:03:34 +0000 2020,"<a href=""http://twitter.com/download/iphone"" rel=""nofollow"">Twitter for iPhone</a>","RT @renoomokri: This is the most stupid action that could have been taken. Instead of destroying their goods, why not seize it (if the law…",This stupid action could taken Instead destroying goods seize law…,"Sentiment(polarity=-0.3, subjectivity=0.3666666666666667)",-0.3,0.3666666666666667,en,0,1,uncleishola,,,renoomokri,"Lagos, Nigeria",
1243841148793257984,Sat Mar 28 10:03:33 +0000 2020,"<a href=""http://twitter.com/download/android"" rel=""nofollow"">Twitter for Android</a>",RT @SAfmnews: A man who tested positive for Covid-19 has been arrested at a village outside Tzaneen in Limpopo. #sabcnews,A man tested positive Covid-19 arrested village outside Tzaneen Limpopo,"Sentiment(polarity=0.11363636363636363, subjectivity=0.29772727272727273)",0.11363636363636363,0.29772727272727273,en,0,70,KgomotsoM_,,sabcnews,SAfmnews,South Africa,
