id,created_at,source,original_text,clean_text,sentiment,polarity,subjectivity,lang,favorite_count,retweet_count,original_author,possibly_sensitive,hashtags,user_mentions,place,place_coord_boundaries1243843350857383936,Sat Mar 28 10:12:18 +0000 2020,"<a href=""http://twitter.com/download/android"" rel=""nofollow"">Twitter for Android</a>","RT @moreki_mo: I swear we are fighting two pandemics 
Covid 19 and Stupidity",I swear fighting two pandemics Covid Stupidity,"Sentiment(polarity=-0.6, subjectivity=1.0)",-0.6,1.0,en,0,77833,DaarkParadise21,,,moreki_mo,Camilizerlandia🇦🇷 ARG 🥀💋🖤,
1243843346386173952,Sat Mar 28 10:12:17 +0000 2020,"<a href=""http://twitter.com/download/iphone"" rel=""nofollow"">Twitter for iPhone</a>","RT @BrandonBeckham_: @realDonaldTrump 🇺🇸 Pres @RealDonaldTrump has taken #coronavirus seriously from the start, responding based on science…",🇺🇸 Pres taken seriously start responding based science…,"Sentiment(polarity=-0.3333333333333333, subjectivity=0.6666666666666666)",-0.3333333333333333,0.6666666666666666,en,0,23,zenith5478,,coronavirus,"BrandonBeckham_, realDonaldTrump, realDonaldTrump",United States,
1243843342435143685,Sat Mar 28 10:12:16 +0000 2020,"<a href=""http://twitter.com/download/iphone"" rel=""nofollow"">Twitter for iPhone</a>",RT @resuitener: Seems like he can afford to treat his workers just a tad better.  https://t.co/qI5AlnnAm2,Seems like afford treat workers tad better,"Sentiment(polarity=0.5, subjectivity=0.5)",0.5,0.5,en,0,5699,NotAcquiescing,False,,resuitener,Dystopian Hell,
1243843338006134784,Sat Mar 28 10:12:15 +0000 2020,"<a href=""http://twitter.com/download/android"" rel=""nofollow"">Twitter for Android</a>","RT @capeannsky: @MalcolmNance @ToddDomke Hospital in Detroit has no vents, no meds to sedate, NO TYLENOL, no PPE, assigned N95 for the YEAR…",Hospital Detroit vents meds sedate NO TYLENOL PPE assigned N95 YEAR…,"Sentiment(polarity=0.0, subjectivity=0.0)",0.0,0.0,en,0,33158,GracieM69614504,,,"capeannsky, MalcolmNance, ToddDomke",Virginia,
1243843334050906112,Sat Mar 28 10:12:14 +0000 2020,"<a href=""http://twitter.com/download/android"" rel=""nofollow"">Twitter for Android</a>",RT @cindylcourtney: I am an NHS nurse and not social media savvy - I only have 106 followers &amp; I’m OK with that. I want to show how Covid-1…,I NHS nurse social media savvy I followers amp I ’ OK I want show Covid-1…,"Sentiment(polarity=0.26666666666666666, subjectivity=0.2833333333333333)",0.26666666666666666,0.2833333333333333,en,0,251,csc1698,,,cindylcourtney,"London, England - SW6",
1243843329869012994,Sat Mar 28 10:12:13 +0000 2020,"<a href=""https://mobile.twitter.com"" rel=""nofollow"">Twitter Web App</a>","@Rosie @TheActorsFund actually Miss Rosie, Trump has done a good job, the economy was doing pretty dam good, there… https://t.co/YiHE5fozEn",actually Miss Rosie Trump done good job economy pretty dam good there…,"Sentiment(polarity=0.4125, subjectivity=0.5750000000000001)",0.4125,0.5750000000000001,en,0,12932,SherryJ1975,,,"Rosie, TheActorsFund","Arizona, USA",
1243843325624377344,Sat Mar 28 10:12:12 +0000 2020,"<a href=""http://twitter.com/download/iphone"" rel=""nofollow"">Twitter for iPhone</a>",RT @Akeel_rashid_: Those who are hiding their travel history are doing great harm to the society. The latest figure on COVID-19 infections…,Those hiding travel history great harm society The latest figure COVID-19 infections…,"Sentiment(polarity=0.65, subjectivity=0.825)",0.65,0.825,en,0,5700,powderleopard,,,Akeel_rashid_,Gulmarg India,
1243843321497255936,Sat Mar 28 10:12:11 +0000 2020,"<a href=""http://twitter.com/download/android"" rel=""nofollow"">Twitter for Android</a>","RT @NelsonHavi: In the meantime, @lawsocietykenya will move to Court on Monday to challenge the curfew which is not only unconstitutional b…",In meantime move Court Monday challenge curfew unconstitutional b…,"Sentiment(polarity=0.0, subjectivity=0.0)",0.0,0.0,en,0,63,jnrmbuvi,,,"NelsonHavi, lawsocietykenya","kitengela
Nakuru",
1243843317156048896,Sat Mar 28 10:12:10 +0000 2020,"<a href=""http://twitter.com/download/android"" rel=""nofollow"">Twitter for Android</a>",@pjmvsual numbers are actually expected to inc since there is inc in the testing capacity. What's really alarming i… https://t.co/6euQ7gYxH1,numbers actually eected inc since inc testing capacity What 's really alarming i…,"Sentiment(polarity=-0.05, subjectivity=0.35)",-0.05,0.35,en,0,27,chim_ette,,,pjmvsual,PH Pearl,
1243843312957698048,Sat Mar 28 10:12:09 +0000 2020,"<a href=""http://twitter.com/download/iphone"" rel=""nofollow"">Twitter for iPhone</a>","RT @PDChina: Not one is infected with #Covid_19 among the 40,000 medics from across China aiding Hubei. How do they do that? Video shows yo…","Not one infected among ,000 medics across China aiding Hubei How Video shows yo…","Sentiment(polarity=0.0, subjectivity=0.0)",0.0,0.0,en,0,0,creativeusercr,,Covid_19,PDChina,"San Antonio, TX",
1243843308834586624,Sat Mar 28 10:12:08 +0000 2020,"<a href=""https://mobile.twitter.com"" rel=""nofollow"">Twitter Web App</a>","RT @AWKathy11: Are my testicles black?

A suspected Covid-19 male patient is lying in bed in the hospital, wearing an oxygen mask over his…",Are testicles black A suspected Covid-19 male patient lying bed hospital wearing oxygen mask his…,"Sentiment(polarity=-0.08333333333333333, subjectivity=0.26666666666666666)",-0.08333333333333333,0.26666666666666666,en,0,6,OyDwayne,,,AWKathy11,Lost Soul; Wubba Lubba Dub Dub,
1243843304715780096,Sat Mar 28 10:12:07 +0000 2020,"<a href=""https://mobile.twitter.com"" rel=""nofollow"">Twitter Web App</a>",RT @Only_rock_radio: #SocialDistancing #CoronaLockdown #Coronavirus #COVID19 discover great artists now on https://t.co/PZqZAxv5zf Code To…,discover great artists Code To…,"Sentiment(polarity=0.8, subjectivity=0.75)",0.8,0.75,en,0,297,jimbasnight,False,"SocialDistancing, CoronaLockdown, Coronavirus, COVID19",Only_rock_radio,"Seattle, WA",
1243843300165066754,Sat Mar 28 10:12:06 +0000 2020,"<a href=""http://twitter.com/download/iphone"" rel=""nofollow"">Twitter for iPhone</a>",RT @jenn7399: me when i call it COVID-19 instead of the rona https://t.co/i46B1OPTXG,call COVID-19 instead rona,"Sentiment(polarity=0.0, subjectivity=0.0)",0.0,0.0,en,0,57,Mayaathadoll,False,,jenn7399,"San Antonio, TX",
1243843296344113152,Sat Mar 28 10:12:05 +0000 2020,"<a href=""http://twitter.com/download/iphone"" rel=""nofollow"">Twitter for iPhone</a>",RT @BernieSanders: This is absolutely barbaric. The cruelty and absurdity of our for-profit health care system is more obvious in the midst…,This absolutely barbaric The cruelty absurdity for-profit health care system obvious midst…,"Sentiment(polarity=0.1, subjectivity=0.7)",0.1,0.7,en,0,5703,johntun18,,,BernieSanders,,
1243843291889586177,Sat Mar 28 10:12:04 +0000 2020,"<a href=""http://twitter.com/download/android"" rel=""nofollow"">Twitter for Android</a>","RT @VedangDesai02: Currently, I am posted in an Exclusive Covid-19 testing and treating facility. Havnt seen the sun since 4-5 days now, do…",Currently I posted Exclusive Covid-19 testing treating facility Havnt seen sun since -5 days do…,"Sentiment(polarity=0.0, subjectivity=0.4)",0.0,0.4,en,0,274,chakrishna4420,,,VedangDesai02,"Nellore, India",
1243843287879991296,Sat Mar 28 10:12:03 +0000 2020,"<a href=""http://twitter.com/download/iphone"" rel=""nofollow"">Twitter for iPhone</a>",RT @GrahameLucas: Now it is obvious why UK did not join EU efforts to combat #coronavirus with ventilator procurement scheme. But why did J…,Now obvious UK join EU efforts combat ventilator procurement scheme But J…,"Sentiment(polarity=0.0, subjectivity=0.5)",0.0,0.5,en,0,77857,JoeyBronson24,,coronavirus,GrahameLucas,"London, England",
1243843283396300800,Sat Mar 28 10:12:02 +0000 2020,"<a href=""http://publicize.wp.com/"" rel=""nofollow"">WordPress.com</a>","COVID-19: Americans to get $1,200 each as Trump signs package https://t.co/2vmVgaNG3w https://t.co/Sh7sboNg39","COVID-19 Americans get 1,200 Trump signs package","Sentiment(polarity=0.0, subjectivity=0.0)",0.0,0.0,en,0,107,OgeneAfrican,False,,,South Africa,
1243843279483002880,Sat Mar 28 10:12:01 +0000 2020,"<a href=""http://twitter.com/download/iphone"" rel=""nofollow"">Twitter for iPhone</a>","RT @ScottGottliebMD: This is GAME CHANGER. Abbott to market, starting next week, a fast point-of-care #coronavirus test, delivering positiv…",This GAME CHANGER Abbott market starting next week fast point-of-care test delivering positiv…,"Sentiment(polarity=-0.05, subjectivity=0.275)",-0.05,0.275,en,0,95,SusanHelbig,,coronavirus,ScottGottliebMD,,
1243843275317891072,Sat Mar 28 10:12:00 +0000 2020,"<a href=""http://twitter.com/download/iphone"" rel=""nofollow"">Twitter for iPhone</a>",Since confirmed cases of covid-19 is on saipan please just please do not go and panic and buy every single thing in… https://t.co/cotq8tcIE9,Since confirmed cases covid-19 saipan please please go panic buy every single thing in…,"Sentiment(polarity=0.1642857142857143, subjectivity=0.6071428571428571)",0.1642857142857143,0.6071428571428571,en,0,31,Eliza_Casilla18,,,,W/Arjay&Jerome🤛🏻,
1243843271178084355,Sat Mar 28 10:11:59 +0000 2020,"<a href=""http://twitter.com/download/android"" rel=""nofollow"">Twitter for Android</a>",RT @AbbottNews: BREAKING: We’re launching a test that can detect COVID-19 in as little as 5 minutes—bringing rapid testing to the frontline…,BREAKING We ’ launching test detect COVID-19 little minutes—bringing rapid testing frontline…,"Sentiment(polarity=-0.1875, subjectivity=0.5)",-0.1875,0.5,en,0,228441,Okie_525,,,AbbottNews,The Hub,
1243843266983813126,Sat Mar 28 10:11:58 +0000 2020,"<a href=""http://twitter.com/download/android"" rel=""nofollow"">Twitter for Android</a>",RT @AnaCabrera: JUST IN: 51 Italian doctors who tested positive for #coronavirus have died - Italian Association of Doctors,JUST IN Italian doctors tested positive died Italian Association Doctors,"Sentiment(polarity=0.07575757575757576, subjectivity=0.1818181818181818)",0.07575757575757576,0.1818181818181818,en,0,29,Sachingk1150,,coronavirus,AnaCabrera,"Salem, India",
1243843262755958784,Sat Mar 28 10:11:57 +0000 2020,"<a href=""http://twitter.com/#!/download/ipad"" rel=""nofollow"">Twitter for iPad</a>",RT @TerpsMLC: If there was ever an argument for keeping our entire hospital system in public hands - this is it.  #greed #Covid_19,If ever argument keeping entire hospital system public hands,"Sentiment(polarity=0.0, subjectivity=0.3458333333333333)",0.0,0.3458333333333333,en,0,21635,DMacKinnonAU,,"greed, Covid_19",TerpsMLC,"RingwoodN, Victoria, Australia",
1243843258389676032,Sat Mar 28 10:11:56 +0000 2020,"<a href=""http://twitter.com/download/iphone"" rel=""nofollow"">Twitter for iPhone</a>","RT @MephsM: Hubby went into respiratory failure (stage 4 COPD) this morning. Ambulance took him to hospital, I was able to sit with him in…",Hubby went respiratory failure stage COPD morning Ambulance took hospital I able sit in…,"Sentiment(polarity=0.09166666666666665, subjectivity=0.4625)",0.09166666666666665,0.4625,en,0,3495,jesecuejimenez,,,MephsM,"California, USA",
1243843254325567488,Sat Mar 28 10:11:55 +0000 2020,"<a href=""http://twitter.com/#!/download/ipad"" rel=""nofollow"">Twitter for iPad</a>",RT @brithume: NYC critical care physician just told Tucker Carlson that he’s been taking Plaquenil to help ward off Covid 19. So far he’s o…,NYC critical care physician told Tucker Carlson ’ taking Plaquenil help ward Covid So far ’ o…,"Sentiment(polarity=0.05, subjectivity=0.9)",0.05,0.9,en,0,237,CharlesWearing,,,brithume,Wisconsin,
1243843250127089665,Sat Mar 28 10:11:54 +0000 2020,"<a href=""http://twitter.com/download/android"" rel=""nofollow"">Twitter for Android</a>","RT @ShirazMaher: I started having symptoms about two weeks ago. The fever was mild and went very quickly. Is it Covid-19? Who knows, but I'…",I started symptoms two weeks ago The fever mild went quickly Is Covid-19 Who knows I'…,"Sentiment(polarity=0.3333333333333333, subjectivity=0.5)",0.3333333333333333,0.5,en,0,21810,lzapp16,,,ShirazMaher,,
1243843245970522113,Sat Mar 28 10:11:53 +0000 2020,"<a href=""http://twitter.com/download/iphone"" rel=""nofollow"">Twitter for iPhone</a>",RT @lhfang: First teen to die from coronavirus was denied care at an urgent care clinic in LA because he did not have health insurance http…,First teen die coronavirus denied care urgent care clinic LA health insurance http…,"Sentiment(polarity=0.125, subjectivity=0.16666666666666666)",0.125,0.16666666666666666,en,0,13,SamuraiElf,,,lhfang,Paris,
1243843241759461376,Sat Mar 28 10:11:52 +0000 2020,"<a href=""http://twitter.com/download/iphone"" rel=""nofollow"">Twitter for iPhone</a>","RT @MichaelCoudrey: Hydroxychloroquine Globally:

-India, Hungary &amp; the United Kingdom ban export of the drug to save supply for themselves…",Hydroxychloroquine Globally -India Hungary amp United Kingdom ban ert drug save supply themselves…,"Sentiment(polarity=0.0, subjectivity=0.0)",0.0,0.0,en,0,5364,Dnlschd,,,MichaelCoudrey,,
1243843237544185856,Sat Mar 28 10:11:51 +0000 2020,"<a href=""http://twitter.com/download/iphone"" rel=""nofollow"">Twitter for iPhone</a>","RT @CNN: A video shows the lungs of a man who had been asymptomatic a few days earlier. Now, the patient has coronavirus and his lungs are…",A video shows lungs man asymptomatic days earlier Now patient coronavirus lungs are…,"Sentiment(polarity=0.0, subjectivity=0.5)",0.0,0.5,en,0,43012,the_very_end_,,,CNN,United States,
1243843233337053184,Sat Mar 28 10:11:50 +0000 2020,"<a href=""http://twitter.com/download/android"" rel=""nofollow"">Twitter for Android</a>","RT @moreki_mo: I swear we are fighting two pandemics 
Covid 19 and Stupidity",I swear fighting two pandemics Covid Stupidity,"Sentiment(polarity=-0.6, subjectivity=1.0)",-0.6,1.0,en,0,5,jkbbalive,,,moreki_mo,,
1243843229222666240,Sat Mar 28 10:11:49 +0000 2020,"<a href=""http://twitter.com/download/android"" rel=""nofollow"">Twitter for Android</a>",RT @satishacharya: Healthcare! #Coronavirus https://t.co/OmOva1YKEC,Healthcare,"Sentiment(polarity=0.0, subjectivity=0.0)",0.0,0.0,en,0,228456,maqahmed,False,Coronavirus,satishacharya,Kingdom of Saudi Arabia,
1243843224990433281,Sat Mar 28 10:11:48 +0000 2020,"<a href=""https://mobile.twitter.com"" rel=""nofollow"">Twitter Web App</a>","@JarredProvich @geracechris @StocksAllUp @mitchellvii Ok here we go again.
Lets see: Flu kills tens of thousands of… https://t.co/kkWhOfFpIQ",Ok go Lets see Flu kills tens thousands of…,"Sentiment(polarity=0.5, subjectivity=0.5)",0.5,0.5,en,0,18,Solidus316YT,,,"JarredProvich, geracechris, StocksAllUp, mitchellvii",,
1243843220766744576,Sat Mar 28 10:11:47 +0000 2020,"<a href=""http://twitter.com/download/android"" rel=""nofollow"">Twitter for Android</a>","RT @Priya_PRS: Minal Dakhav Bhosale, a virologist who developed Covid-19 test-kit in a record time of 6 wks instead of stipulated 4 mnths d…",Minal Dakhav Bhosale virologist developed Covid-19 test-kit record time wks instead stipulated mnths d…,"Sentiment(polarity=0.1, subjectivity=0.3)",0.1,0.3,en,0,169,raghavpandeyy,,,Priya_PRS,"Mumbai, India",
1243843216551694346,Sat Mar 28 10:11:46 +0000 2020,"<a href=""http://twitter.com/download/iphone"" rel=""nofollow"">Twitter for iPhone</a>","RT @Tesco: Some little helps for safer shopping from some of our wonderful Tesco colleagues. Because now more than ever, #EveryLittleHelps…",Some little helps safer shopping wonderful Tesco colleagues Because ever …,"Sentiment(polarity=0.40625, subjectivity=0.75)",0.40625,0.75,en,0,4,abneeeeeeet,,EveryLittleHelps,Tesco,🇬🇧,
1243843212352970752,Sat Mar 28 10:11:45 +0000 2020,"<a href=""http://twitter.com/#!/download/ipad"" rel=""nofollow"">Twitter for iPad</a>","RT @gmanews: BREAKING: DOH reports 272 new COVID-19 cases, 14 new deaths, and 4 new recoveries.

This brings the totals to confirmed 1,075…","BREAKING DOH reports new COVID-19 cases new deaths new recoveries This brings totals confirmed ,075…","Sentiment(polarity=0.20227272727272727, subjectivity=0.5909090909090908)",0.20227272727272727,0.5909090909090908,en,3,0,jaytayag15,,,gmanews,Philippines,
1243843208209039363,Sat Mar 28 10:11:44 +0000 2020,"<a href=""https://mobile.twitter.com"" rel=""nofollow"">Twitter Web App</a>",RT @ndreamon: Things you can say during sex and COVID-19 outbreak isolation:,Things say sex COVID-19 outbreak isolation,"Sentiment(polarity=0.0, subjectivity=0.0)",0.0,0.0,en,0,44,egojidinoyumi,,,ndreamon,,
1243843203977170945,Sat Mar 28 10:11:43 +0000 2020,"<a href=""http://twitter.com/download/android"" rel=""nofollow"">Twitter for Android</a>",RT @premnsikka: Richard Branson is estimated to be worth $4bn &amp; has used tax havens to avoid taxes. Entities like Virgin Healthcare have pa…,Richard Branson estimated worth 4bn amp used tax havens avoid taxes Entities like Virgin Healthcare pa…,"Sentiment(polarity=0.3, subjectivity=0.1)",0.3,0.1,en,0,90,aljola,,,premnsikka,Ultima Thule,
1243843199598120960,Sat Mar 28 10:11:42 +0000 2020,"<a href=""http://twitter.com/download/android"" rel=""nofollow"">Twitter for Android</a>",RT @oranglaut: After being totally enamoured with the words of WA premier that the cruise ships would not be allowed to berth in Fremantle…,After totally enamoured words WA premier cruise ships would allowed berth Fremantle…,"Sentiment(polarity=0.0, subjectivity=0.75)",0.0,0.75,en,0,43013,jayjay1950,,,oranglaut,,
1243843195374653440,Sat Mar 28 10:11:41 +0000 2020,"<a href=""http://twitter.com/download/iphone"" rel=""nofollow"">Twitter for iPhone</a>",RT @brithume: NYC critical care physician just told Tucker Carlson that he’s been taking Plaquenil to help ward off Covid 19. So far he’s o…,NYC critical care physician told Tucker Carlson ’ taking Plaquenil help ward Covid So far ’ o…,"Sentiment(polarity=0.05, subjectivity=0.9)",0.05,0.9,en,0,7194,canamtrng,,,brithume,"South Carolina, USA",
1243843191427739648,Sat Mar 28 10:11:40 +0000 2020,"<a href=""http://twitter.com/download/iphone"" rel=""nofollow"">Twitter for iPhone</a>","RT @GovCanHealth: Everyone has a role to play to protect the health and safety of Canadians from COVID-19. Simple actions, like washing you…",Everyone role play protect health safety Canadians COVID-19 Simple actions like washing you…,"Sentiment(polarity=0.0, subjectivity=0.35714285714285715)",0.0,0.35714285714285715,en,0,17,nala_sam,,,GovCanHealth,"Manila, Philippines",
1243843186986016773,Sat Mar 28 10:11:39 +0000 2020,"<a href=""http://twitter.com/download/android"" rel=""nofollow"">Twitter for Android</a>","#COVID19 and it's spread...How govt. Hold control of life. 

#CoronaLockdown #coronavirus #StayHomeSaveLives https://t.co/QCKLVSlDRm",'s spread ... How govt Hold control life,"Sentiment(polarity=0.0, subjectivity=0.0)",0.0,0.0,en,0,2124,HussainShaikhh,False,"COVID19, CoronaLockdown, coronavirus, StayHomeSaveLives",,,
1243843182728601600,Sat Mar 28 10:11:38 +0000 2020,"<a href=""https://mobile.twitter.com"" rel=""nofollow"">Twitter Web App</a>","RT @rapplerdotcom: BREAKING. DOH confirms 272 new cases of #coronavirus; total cases in PH now at 1,075. #COVID19PH | via @bnzmagsambol 

S…","BREAKING DOH confirms new cases total cases PH ,075 via S…","Sentiment(polarity=0.06818181818181818, subjectivity=0.6022727272727273)",0.06818181818181818,0.6022727272727273,en,0,2,sheiscmremada,,"coronavirus, COVID19PH","rapplerdotcom, bnzmagsambol",Republic of the Philippines,
1243843178819698689,Sat Mar 28 10:11:37 +0000 2020,"<a href=""http://twitter.com/download/iphone"" rel=""nofollow"">Twitter for iPhone</a>","RT @ChicagoTraderrr: I lost my Dad this morning to COVID-19. He was my rock, my best friend, and my hero. He had virtually no symptoms and…",I lost Dad morning COVID-19 He rock best friend hero He virtually symptoms and…,"Sentiment(polarity=1.0, subjectivity=0.3)",1.0,0.3,en,2,0,abbiejones0,,,ChicagoTraderrr,swansea,
1243843174532956161,Sat Mar 28 10:11:36 +0000 2020,"<a href=""http://twitter.com/download/android"" rel=""nofollow"">Twitter for Android</a>",RT @AnaCabrera: JUST IN: 51 Italian doctors who tested positive for #coronavirus have died - Italian Association of Doctors,JUST IN Italian doctors tested positive died Italian Association Doctors,"Sentiment(polarity=0.07575757575757576, subjectivity=0.1818181818181818)",0.07575757575757576,0.1818181818181818,en,0,18023,RamanandChennai,,coronavirus,AnaCabrera,,
1243843170309492736,Sat Mar 28 10:11:35 +0000 2020,"<a href=""http://twitter.com/download/android"" rel=""nofollow"">Twitter for Android</a>",RT @equipshare_ng: At this season of Covid 19 we know how stressful and difficult  it can be to get the appropriate equipment for your spec…,At season Covid know stressful difficult get appropriate equipment spec…,"Sentiment(polarity=0.0, subjectivity=0.75)",0.0,0.75,en,0,14,builderlynus,,,equipshare_ng,,
1243843166127652875,Sat Mar 28 10:11:34 +0000 2020,"<a href=""http://twitter.com/download/iphone"" rel=""nofollow"">Twitter for iPhone</a>","RT @Georgia_Hart_xx: 20 years old and have just been told that I’ve tested positive for COVID - 19, please don’t think that because you’re…",years old told I ’ tested positive COVID please ’ think ’ re…,"Sentiment(polarity=0.16363636363636364, subjectivity=0.3727272727272727)",0.16363636363636364,0.3727272727272727,en,0,9,mjgx_,,,Georgia_Hart_xx,UK,
1243843162101043200,Sat Mar 28 10:11:33 +0000 2020,"<a href=""http://twitter.com/download/android"" rel=""nofollow"">Twitter for Android</a>","RT @WebMD: When it comes to spotting symptoms, do you know how to tell the new coronavirus (also known as COVID-19) from seasonal allergies…",When comes spotting symptoms know tell new coronavirus also known COVID-19 seasonal allergies…,"Sentiment(polarity=0.13636363636363635, subjectivity=0.45454545454545453)",0.13636363636363635,0.45454545454545453,en,0,0,RMel4060,,,WebMD,United States,
1243843157747314689,Sat Mar 28 10:11:32 +0000 2020,"<a href=""http://twitter.com/download/android"" rel=""nofollow"">Twitter for Android</a>",RT @noconversion: HE can solve #Coronavirus  problem .... but he is still on bail on rape charges ... https://t.co/yseZaiXDXs,HE solve problem ... still bail rape charges ...,"Sentiment(polarity=0.0, subjectivity=0.0)",0.0,0.0,en,1,0,AmolTikam,False,Coronavirus,noconversion,,
1243843153691639808,Sat Mar 28 10:11:31 +0000 2020,"<a href=""https://mobile.twitter.com"" rel=""nofollow"">Twitter Web App</a>","RT @alabiopeyemiola: Fought Civil War, He survived

They jailed him, he didn't die

They attempted to bomb him in Kaduna, he didn't die

Th…",Fought Civil War He survived They jailed n't die They attempted bomb Kaduna n't die Th…,"Sentiment(polarity=0.0, subjectivity=0.0)",0.0,0.0,en,1,0,KolaSalamniyas,,,alabiopeyemiola,"Lagos, Nigeria",
1243843149551861760,Sat Mar 28 10:11:30 +0000 2020,"<a href=""https://mobile.twitter.com"" rel=""nofollow"">Twitter Web App</a>",RT @BusyDrT: Never trust a desperate man.... He’s trying to save himself from the storm that’s coming. WOW! Dr. #Fauci in New England Journ…,Never trust desperate man ... He ’ trying save storm ’ coming WOW Dr. New England Journ…,"Sentiment(polarity=-0.12121212121212122, subjectivity=0.8181818181818182)",-0.12121212121212122,0.8181818181818182,en,0,77899,HeatherSpergel,,Fauci,BusyDrT,New Jersey,
1243843145294471169,Sat Mar 28 10:11:29 +0000 2020,"<a href=""http://twitter.com/download/android"" rel=""nofollow"">Twitter for Android</a>","RT @MazherArshad: Feel-good story of the day. A 101 years old man has recovered from Covid-19 in Italy. He has survived the 1918 flu, a Wor…",Feel-good story day A years old man recovered Covid-19 Italy He survived flu Wor…,"Sentiment(polarity=0.1, subjectivity=0.2)",0.1,0.2,en,0,2277,nafasbaru_,,,MazherArshad,,
1243843141083385856,Sat Mar 28 10:11:28 +0000 2020,"<a href=""http://twitter.com/download/android"" rel=""nofollow"">Twitter for Android</a>","RT @Ogilvy: What does COVID-19 mean for brands on social media?

Ogilvy's Renata Mittnacht &amp; Carly Gibson lay out the best practices for br…",What COVID-19 mean brands social media Ogilvy 's Renata Mittnacht amp Carly Gibson lay best practices br…,"Sentiment(polarity=0.24027777777777778, subjectivity=0.3513888888888889)",0.24027777777777778,0.3513888888888889,en,0,6,pawilectura,,,Ogilvy,ELJ Communications Center,
1243843136549531648,Sat Mar 28 10:11:27 +0000 2020,"<a href=""http://twitter.com/download/iphone"" rel=""nofollow"">Twitter for iPhone</a>","RT @Georgia_Hart_xx: 20 years old and have just been told that I’ve tested positive for COVID - 19, please don’t think that because you’re…",years old told I ’ tested positive COVID please ’ think ’ re…,"Sentiment(polarity=0.16363636363636364, subjectivity=0.3727272727272727)",0.16363636363636364,0.3727272727272727,en,0,228487,DylanHepworth05,,,Georgia_Hart_xx,"Hull, England",
1243843132753616896,Sat Mar 28 10:11:26 +0000 2020,"<a href=""http://twitter.com/download/iphone"" rel=""nofollow"">Twitter for iPhone</a>","RT @marklowen: #Italy is struggling to take in the daily losses from #Coronavirus. After its biggest one-day death toll, Pope Francis gave…",struggling take daily losses After biggest one-day death toll Pope Francis gave…,"Sentiment(polarity=0.0, subjectivity=0.0)",0.0,0.0,en,0,948,VictoriaCraig,,"Italy, Coronavirus",marklowen,"London, England",
