id,created_at,source,original_text,clean_text,sentiment,polarity,subjectivity,lang,favorite_count,retweet_count,original_author,possibly_sensitive,hashtags,user_mentions,place,place_coord_boundaries1243845141695094784,Sat Mar 28 10:19:25 +0000 2020,"<a href=""http://twitter.com/download/android"" rel=""nofollow"">Twitter for Android</a>","RT @Lala_The_Don: China-1000 bed hospitals built in 9 days

Liberals-What's our govt doing, Learn from china

India-Made 2200 bed Covid-19…",China-1000 bed hospitals built days Liberals-What 's govt Learn china India-Made bed Covid-19…,"Sentiment(polarity=0.0, subjectivity=0.0)",0.0,0.0,en,0,1267,3Gblah,,,Lala_The_Don,Himalayan Island,
1243845137383464960,Sat Mar 28 10:19:24 +0000 2020,"<a href=""http://twitter.com/download/android"" rel=""nofollow"">Twitter for Android</a>",New COVID-19 Measures Announced by an Taoiseach 27 March 2020 | Age Action https://t.co/mbv25gSv4l via @ageaction,New COVID-19 Measures Announced Taoiseach March Age Action via,"Sentiment(polarity=0.11818181818181818, subjectivity=0.2772727272727273)",0.11818181818181818,0.2772727272727273,en,0,4,davegkelly,False,,AgeAction,Dublino,
1243845133390565376,Sat Mar 28 10:19:23 +0000 2020,"<a href=""https://mobile.twitter.com"" rel=""nofollow"">Twitter Web App</a>","Michael T. Osterholm, PhD, MPH | CIDRAP
Regents Professor, McKnight Presidential Endowed Chair in Public Health, di… https://t.co/wG5muDaCHM",Michael T. Osterholm PhD MPH CIDRAP Regents Professor McKnight Presidential Endowed Chair Public Health di…,"Sentiment(polarity=0.0, subjectivity=0.06666666666666667)",0.0,0.06666666666666667,en,0,784,ConstantSkeptic,False,,,North Central Florida,
1243845129057828865,Sat Mar 28 10:19:22 +0000 2020,"<a href=""http://twitter.com/download/iphone"" rel=""nofollow"">Twitter for iPhone</a>","RT @WebMD: When it comes to spotting symptoms, do you know how to tell the new coronavirus (also known as COVID-19) from seasonal allergies…",When comes spotting symptoms know tell new coronavirus also known COVID-19 seasonal allergies…,"Sentiment(polarity=0.13636363636363635, subjectivity=0.45454545454545453)",0.13636363636363635,0.45454545454545453,en,0,1032,tweetcharisreid,,,WebMD, Derbyshire ,
1243845124833964033,Sat Mar 28 10:19:21 +0000 2020,"<a href=""http://twitter.com/download/android"" rel=""nofollow"">Twitter for Android</a>",RT @ImWhoooIm: Carelessness and lack of precaution is the past tense of COVID-19.,Carelessness lack precaution past tense COVID-19,"Sentiment(polarity=-0.29166666666666663, subjectivity=0.375)",-0.29166666666666663,0.375,en,3,0,Rapunzel_Jiya1,,,ImWhoooIm,India,
1243845120526561280,Sat Mar 28 10:19:20 +0000 2020,"<a href=""http://twitter.com/download/android"" rel=""nofollow"">Twitter for Android</a>",RT @SAfmnews: A man who tested positive for Covid-19 has been arrested at a village outside Tzaneen in Limpopo. #sabcnews,A man tested positive Covid-19 arrested village outside Tzaneen Limpopo,"Sentiment(polarity=0.11363636363636363, subjectivity=0.29772727272727273)",0.11363636363636363,0.29772727272727273,en,11,9,Rakgadi_K,,sabcnews,SAfmnews,Wherever the wind blows!,
1243845116512567301,Sat Mar 28 10:19:19 +0000 2020,"<a href=""http://twitter.com/download/android"" rel=""nofollow"">Twitter for Android</a>",RT @dansiddiqui: Migrant workers walk along a road to return to their villages in Jhansi from Rohtak (almost 500 kms) during a nationwide l…,Migrant workers walk along road return villages Jhansi Rohtak almost kms nationwide l…,"Sentiment(polarity=0.0, subjectivity=0.0)",0.0,0.0,en,0,76171,fundianabones,,,dansiddiqui,Grey side of the moon,
1243845112423165952,Sat Mar 28 10:19:18 +0000 2020,"<a href=""https://www.socialchamp.io"" rel=""nofollow"">SocialChamp IO </a>",RT @FarzalSays: Central bank clarifies issues relating to insurance - https://t.co/T4WlqlRcyf https://t.co/8oJRQEUuPb Central bank clarifie…,Central bank clarifies issues relating insurance Central bank clarifie…,"Sentiment(polarity=0.0, subjectivity=0.25)",0.0,0.25,en,0,266,FarzalSays,False,,FarzalSays,,
1243845108291772416,Sat Mar 28 10:19:17 +0000 2020,"<a href=""http://twitter.com/#!/download/ipad"" rel=""nofollow"">Twitter for iPad</a>",RT @LodeVerreyen: This for sure will save lifes. #CoronaLockdown #Trump #covid-19 https://t.co/WyEz6VzPND,This sure save lifes,"Sentiment(polarity=0.5, subjectivity=0.8888888888888888)",0.5,0.8888888888888888,en,0,0,PietroGhezzi,False,"CoronaLockdown, Trump, covid",LodeVerreyen,"Falmer, Brighton, England",
1243845104042938368,Sat Mar 28 10:19:16 +0000 2020,"<a href=""http://twitter.com/download/android"" rel=""nofollow"">Twitter for Android</a>",RT @GascoyneEstate: Our cleaners are self isolating so our residents are helping clean up our estate. Only once a day. #coronavirus #CleanU…,Our cleaners self isolating residents helping clean estate Only day …,"Sentiment(polarity=0.18333333333333335, subjectivity=0.8500000000000001)",0.18333333333333335,0.8500000000000001,en,0,3446,Athemis2014,,coronavirus,GascoyneEstate,London,
1243845099794173952,Sat Mar 28 10:19:15 +0000 2020,"<a href=""http://twitter.com/download/iphone"" rel=""nofollow"">Twitter for iPhone</a>","RT @moreki_mo: I swear we are fighting two pandemics 
Covid 19 and Stupidity",I swear fighting two pandemics Covid Stupidity,"Sentiment(polarity=-0.6, subjectivity=1.0)",-0.6,1.0,en,0,389,BBP2DDP,,,moreki_mo,,
1243845095708860416,Sat Mar 28 10:19:14 +0000 2020,"<a href=""http://twitter.com/download/android"" rel=""nofollow"">Twitter for Android</a>",RT @MohamedBinZayed: I received a phone call from Indian Prime Minister Narendra Modi during which we discussed bilateral ties &amp; efforts to…,I received phone call Indian Prime Minister Narendra Modi discussed bilateral ties amp efforts to…,"Sentiment(polarity=0.0, subjectivity=0.0)",0.0,0.0,en,0,226515,omaralshehhi888,,,MohamedBinZayed,,
1243845091208433664,Sat Mar 28 10:19:13 +0000 2020,"<a href=""http://twitter.com/download/android"" rel=""nofollow"">Twitter for Android</a>","RT @ChicagoTraderrr: I lost my Dad this morning to COVID-19. He was my rock, my best friend, and my hero. He had virtually no symptoms and…",I lost Dad morning COVID-19 He rock best friend hero He virtually symptoms and…,"Sentiment(polarity=1.0, subjectivity=0.3)",1.0,0.3,en,0,542,joanaftnobody,,,ChicagoTraderrr,all that jazz,
1243845087290892289,Sat Mar 28 10:19:12 +0000 2020,"<a href=""http://twitter.com/download/android"" rel=""nofollow"">Twitter for Android</a>","RT @ChicagoTraderrr: I lost my Dad this morning to COVID-19. He was my rock, my best friend, and my hero. He had virtually no symptoms and…",I lost Dad morning COVID-19 He rock best friend hero He virtually symptoms and…,"Sentiment(polarity=1.0, subjectivity=0.3)",1.0,0.3,en,0,226531,johannesgbem,,,ChicagoTraderrr,Ibadan,
1243845083075674112,Sat Mar 28 10:19:11 +0000 2020,"<a href=""https://mobile.twitter.com"" rel=""nofollow"">Twitter Web App</a>","RT @StefSimanowitz: 1/3. On 13 March, @Channel4News reported on a new rapid #coronavirus testing kit - made in the UK - that diagnoses #cor…",/3 On March reported new rapid testing kit made UK diagnoses …,"Sentiment(polarity=0.13636363636363635, subjectivity=0.45454545454545453)",0.13636363636363635,0.45454545454545453,en,0,3025,coolcatno1,,coronavirus,"StefSimanowitz, Channel4News",,
1243845078570823681,Sat Mar 28 10:19:10 +0000 2020,"<a href=""https://mobile.twitter.com"" rel=""nofollow"">Twitter Web App</a>","RT @ChicagoTraderrr: I lost my Dad this morning to COVID-19. He was my rock, my best friend, and my hero. He had virtually no symptoms and…",I lost Dad morning COVID-19 He rock best friend hero He virtually symptoms and…,"Sentiment(polarity=1.0, subjectivity=0.3)",1.0,0.3,en,0,228,Meysypp_,,,ChicagoTraderrr,"Muara Teweh, kalimantan Tengah",
1243845074636558336,Sat Mar 28 10:19:09 +0000 2020,"<a href=""https://mobile.twitter.com"" rel=""nofollow"">Twitter Web App</a>",RT @SkyNews: Coronavirus: Falkland Islands brace for first COVID-19 case https://t.co/ofpdJg50xA,Coronavirus Falkland Islands brace first COVID-19 case,"Sentiment(polarity=0.25, subjectivity=0.3333333333333333)",0.25,0.3333333333333333,en,0,218,at_revenge,False,,SkyNews,Australia,
1243845070526259200,Sat Mar 28 10:19:08 +0000 2020,"<a href=""https://mobile.twitter.com"" rel=""nofollow"">Twitter Web App</a>","RT @BelTel: Coronavirus: So what does it mean for your holiday plans? #coronavirus #COVID19 
https://t.co/mLGCa6rRPf https://t.co/lA6M3LSig5",Coronavirus So mean holiday plans,"Sentiment(polarity=-0.3125, subjectivity=0.6875)",-0.3125,0.6875,en,0,206,1realworld8,False,"coronavirus, COVID19",BelTel,"Susquehanna Valley ,USA",
1243845066197733376,Sat Mar 28 10:19:07 +0000 2020,"<a href=""http://twitter.com/download/android"" rel=""nofollow"">Twitter for Android</a>","RT @ChicagoTraderrr: I lost my Dad this morning to COVID-19. He was my rock, my best friend, and my hero. He had virtually no symptoms and…",I lost Dad morning COVID-19 He rock best friend hero He virtually symptoms and…,"Sentiment(polarity=1.0, subjectivity=0.3)",1.0,0.3,en,0,226561,s_jay_p,,,ChicagoTraderrr,NG,
1243845062137729025,Sat Mar 28 10:19:06 +0000 2020,"<a href=""https://mobile.twitter.com"" rel=""nofollow"">Twitter Web App</a>","RT @DementiaUK: We've added some more information to our 'Coronavirus: questions and answers', and we will continue to update this page. Re…",We 've added information 'Coronavirus questions answers continue update page Re…,"Sentiment(polarity=0.0, subjectivity=0.0)",0.0,0.0,en,0,104,hounslowrotary,,,DementiaUK,Hounslow,
1243845057511292929,Sat Mar 28 10:19:05 +0000 2020,"<a href=""http://twitter.com/download/android"" rel=""nofollow"">Twitter for Android</a>","RT @thebbookshop: Times are hard for everybody of course but if you feel inclined to support booksellers, any donations are appreciated to…",Times hard everybody course feel inclined support booksellers donations appreciated to…,"Sentiment(polarity=-0.04583333333333334, subjectivity=0.3208333333333333)",-0.04583333333333334,0.3208333333333333,en,0,1465,gyllzd,,,thebbookshop,London,
1243845053493190656,Sat Mar 28 10:19:04 +0000 2020,"<a href=""http://twitter.com/download/android"" rel=""nofollow"">Twitter for Android</a>","RT @adeolakolade1: Me and my guys made hand sanitizers, and distribute among old market women in akure and also sensitize them about the co…",Me guys made hand sanitizers distribute among old market women akure also sensitize co…,"Sentiment(polarity=0.1, subjectivity=0.2)",0.1,0.2,en,0,226578,AdesusiG,,,adeolakolade1,,
1243845049407897601,Sat Mar 28 10:19:03 +0000 2020,"<a href=""http://twitter.com/download/android"" rel=""nofollow"">Twitter for Android</a>",RT @BISouthAfrica: BREAKING: Patrice Motsepe and his businesses donate R1 billion to fight Covid-19 in South africa. @BISouthAfrica,BREAKING Patrice Motsepe businesses donate R1 billion fight Covid-19 South africa,"Sentiment(polarity=0.0, subjectivity=0.0)",0.0,0.0,en,0,194,MarcusTucker_,,,"BISouthAfrica, BISouthAfrica",South Africa,
1243845045301563393,Sat Mar 28 10:19:02 +0000 2020,"<a href=""http://twitter.com/download/android"" rel=""nofollow"">Twitter for Android</a>","RT @ughitsjoe: My girlfriend has tested positive for COVID-19. I just wanted to share my story how this has affected us. 

I was going to g…",My girlfriend tested positive COVID-19 I wanted share story affected us I going g…,"Sentiment(polarity=0.22727272727272727, subjectivity=0.5454545454545454)",0.22727272727272727,0.5454545454545454,en,0,6,nadjaalya_,,,ughitsjoe,KUL➡️KCH,
1243845041082294274,Sat Mar 28 10:19:01 +0000 2020,"<a href=""http://twitter.com/download/iphone"" rel=""nofollow"">Twitter for iPhone</a>","RT @ChicagoTraderrr: I lost my Dad this morning to COVID-19. He was my rock, my best friend, and my hero. He had virtually no symptoms and…",I lost Dad morning COVID-19 He rock best friend hero He virtually symptoms and…,"Sentiment(polarity=1.0, subjectivity=0.3)",1.0,0.3,en,0,399,TheAmySeiler,,,ChicagoTraderrr,,
1243845036841865217,Sat Mar 28 10:19:00 +0000 2020,"<a href=""http://twitter.com/download/iphone"" rel=""nofollow"">Twitter for iPhone</a>",RT @AsherV3: Someone needs to say “Hammer. Nail. Coffin.” to Covid-19 so we can see these young kings in the Playoffs 〽️🔥 https://t.co/sdXg…,Someone needs say “ Hammer Nail Coffin. ” Covid-19 see young kings Playoffs 〽️,"Sentiment(polarity=0.1, subjectivity=0.4)",0.1,0.4,en,0,21,resteasy24,,,AsherV3,,
1243845032681058304,Sat Mar 28 10:18:59 +0000 2020,"<a href=""http://twitter.com/download/android"" rel=""nofollow"">Twitter for Android</a>","RT @SloughForEU: Remember that club we were once a member of, that people claimed just took our money and offered nothing in return?
Turns…",Remember club member people claimed took money offered nothing return Turns…,"Sentiment(polarity=0.0, subjectivity=0.0)",0.0,0.0,en,0,157,Steve4EU,,,SloughForEU,Bishop's Stortford,
1243845028574662656,Sat Mar 28 10:18:58 +0000 2020,"<a href=""http://twitter.com/download/android"" rel=""nofollow"">Twitter for Android</a>","RT @PiyushGoyal: Preparing to Combat Coronavirus: In a novel initiative, Railways has converted train coaches into isolation wards for COVI…",Preparing Combat Coronavirus In novel initiative Railways converted train coaches isolation wards COVI…,"Sentiment(polarity=0.0, subjectivity=0.0)",0.0,0.0,en,0,194,biosdaddyy,,,PiyushGoyal,"Lucknow, India. ",
1243845024338587648,Sat Mar 28 10:18:57 +0000 2020,"<a href=""http://twitter.com/download/android"" rel=""nofollow"">Twitter for Android</a>",RT @BethRigby: I asked Simon Stevens (@NHSuk) the question that the deputy CMO couldn’t answer y’day. How many NHS staff are currently off…,I asked Simon Stevens question deputy CMO ’ answer ’ day How many NHS staff currently off…,"Sentiment(polarity=0.25, subjectivity=0.45)",0.25,0.45,en,0,226630,r_o_y_g_b_i_v,,,"BethRigby, NHSuk",Europe,
1243845020190412801,Sat Mar 28 10:18:56 +0000 2020,"<a href=""http://twitter.com/download/android"" rel=""nofollow"">Twitter for Android</a>",RT @NOCHILL_GOD: Checked on @idriselba since he got tested positive for #Covid_19 ... he’s still fine and chilled. I had to hung up. Downlo…,Checked since got tested positive ... ’ still fine chilled I hung Downlo…,"Sentiment(polarity=0.32196969696969696, subjectivity=0.5227272727272727)",0.32196969696969696,0.5227272727272727,en,0,76297,StaWeezyMP,,Covid_19,"NOCHILL_GOD, idriselba","KwaZulu, South Africa",
1243845015920447488,Sat Mar 28 10:18:55 +0000 2020,"<a href=""http://twitter.com/download/android"" rel=""nofollow"">Twitter for Android</a>",RT @yennikwok: West Java province has started to offer drive-through COVID-19 testing service,West Java province started offer drive-through COVID-19 testing service,"Sentiment(polarity=0.0, subjectivity=0.0)",0.0,0.0,en,0,1036,Timotiusmnt,,,yennikwok,,
1243845011688603648,Sat Mar 28 10:18:54 +0000 2020,"<a href=""http://twitter.com/#!/download/ipad"" rel=""nofollow"">Twitter for iPad</a>",RT @Sierra_Labs: A #coronavirus home test kit developed jointly by @Bruneluni @LancasterUni and @UniOfSurrey could yield #COVID19 test resu…,A home test kit developed jointly could yield test resu…,"Sentiment(polarity=0.1, subjectivity=0.3)",0.1,0.3,en,0,2376,aifbw,,"coronavirus, COVID19","Sierra_Labs, Bruneluni, LancasterUni, UniOfSurrey",,
1243845007406030848,Sat Mar 28 10:18:53 +0000 2020,"<a href=""http://twitter.com/download/iphone"" rel=""nofollow"">Twitter for iPhone</a>",RT @dglo4me: If you believe the world will overcome covid-19 retweet.,If believe world overcome covid-19 retweet,"Sentiment(polarity=0.0, subjectivity=0.0)",0.0,0.0,en,0,105,nuewha,,,dglo4me,Malaysia 🇲🇾,
1243845003173974021,Sat Mar 28 10:18:52 +0000 2020,"<a href=""http://twitter.com/download/android"" rel=""nofollow"">Twitter for Android</a>","RT @rapplerdotcom: BREAKING NEWS. The Philippines’ confirmed cases of the novel #coronavirus are now at 1,075 as the DOH reported 272 new c…","BREAKING NEWS The Philippines ’ confirmed cases novel ,075 DOH reported new c…","Sentiment(polarity=0.2681818181818182, subjectivity=0.7272727272727273)",0.2681818181818182,0.7272727272727273,en,0,2,ericsonjustin30,,coronavirus,rapplerdotcom,,
1243844999185195009,Sat Mar 28 10:18:51 +0000 2020,"<a href=""http://twitter.com/download/android"" rel=""nofollow"">Twitter for Android</a>",@iamamirofficial @SAfridiOfficial @harbhajan_singh @CJordan @simadwasim @realshoaibmalik @babarazam258 Why don't yo… https://t.co/YazU2wRWeu,Why n't yo…,"Sentiment(polarity=0.0, subjectivity=0.0)",0.0,0.0,en,0,21645,KohliFanteam,,,"iamamirofficial, SAfridiOfficial, harbhajan_singh, CJordan, simadwasim, realshoaibmalik, babarazam258",India,
1243844995007885312,Sat Mar 28 10:18:50 +0000 2020,"<a href=""https://mobile.twitter.com"" rel=""nofollow"">Twitter Web App</a>",RT @BetaBriefing: #Slovenian energy group GEN-I said it is cutting by 15% the prices at which it sells electricity to households and small…,energy group GEN-I said cutting prices sells electricity households small…,"Sentiment(polarity=-0.6, subjectivity=0.9)",-0.6,0.9,en,0,16,Kovaccica,False,Slovenian,BetaBriefing,,
1243844990708654080,Sat Mar 28 10:18:49 +0000 2020,"<a href=""http://twitter.com/download/iphone"" rel=""nofollow"">Twitter for iPhone</a>",RT @MbuyiseniNdlozi: BREAKING: WHO confirms #Covid_19 as airborne &amp; remain 8 hrs in air! So everyone is required to *wear mask everywhere!!…,BREAKING WHO confirms airborne amp remain hrs air So everyone required *wear mask everywhere …,"Sentiment(polarity=0.0, subjectivity=0.0)",0.0,0.0,en,0,0,mbali_l_tafeni,,Covid_19,MbuyiseniNdlozi,"Cape Town, South Africa",
1243844986413690881,Sat Mar 28 10:18:48 +0000 2020,"<a href=""http://twitter.com/download/iphone"" rel=""nofollow"">Twitter for iPhone</a>","RT @espn: Former Titans DB Myron Rolle left the NFL to attend medical school back in 2013.

Now, Rolle is a neurosurgery resident who is se…",Former Titans DB Myron Rolle left NFL attend medical school back Now Rolle neurosurgery resident se…,"Sentiment(polarity=0.0, subjectivity=0.0)",0.0,0.0,en,0,226654,RobertRoddy4,,,espn,,
1243844982466924545,Sat Mar 28 10:18:47 +0000 2020,"<a href=""http://twitter.com/#!/download/ipad"" rel=""nofollow"">Twitter for iPad</a>","RT @ketoendurance: Study in New York - 97% of people hospitalised were metabolically unhealthy. Eg overweight, diabetes, hypertension. 

St…",Study New York people hospitalised metabolically unhealthy Eg overweight diabetes hypertension St…,"Sentiment(polarity=-0.13181818181818183, subjectivity=0.5772727272727273)",-0.13181818181818183,0.5772727272727273,en,0,1,HansWouter,,,ketoendurance,Amsterdam,
1243844978201243649,Sat Mar 28 10:18:46 +0000 2020,"<a href=""http://twitter.com/download/android"" rel=""nofollow"">Twitter for Android</a>",RT @sherlockmichael: And God is infecting #Christians with #Coronavirus because they don't oppose #Jesus?,And God infecting n't oppose,"Sentiment(polarity=0.0, subjectivity=0.0)",0.0,0.0,en,0,2907,ATHE1STP0WER,,"Christians, Coronavirus, Jesus",sherlockmichael,Here.In front of you.,
1243844974073896960,Sat Mar 28 10:18:45 +0000 2020,"<a href=""http://twitter.com/download/android"" rel=""nofollow"">Twitter for Android</a>",RT @narendramodi: Today I had an extensive interaction with Radio Jockeys from different parts of India. Radio has a major role to play in…,Today I extensive interaction Radio Jockeys different parts India Radio major role play in…,"Sentiment(polarity=0.020833333333333332, subjectivity=0.4777777777777778)",0.020833333333333332,0.4777777777777778,en,0,5,LoveBirdDream,,,narendramodi,"Mumbai, India",
1243844969841872897,Sat Mar 28 10:18:44 +0000 2020,"<a href=""http://twitter.com/download/android"" rel=""nofollow"">Twitter for Android</a>",RT @narendramodi: We all are one in this battle against COVID-19! #IndiaFightsCorona,We one battle COVID-19,"Sentiment(polarity=0.0, subjectivity=0.0)",0.0,0.0,en,0,4,sanjay_rai,,IndiaFightsCorona,narendramodi,Singapore ,
1243844965438013440,Sat Mar 28 10:18:43 +0000 2020,"<a href=""http://twitter.com/download/iphone"" rel=""nofollow"">Twitter for iPhone</a>","RT @OutbreakJake: ""Community acquisition is the most likely route in the vast majority."" 
Sadly many, including the media, often jump to th…",`` Community acquisition likely route vast majority '' Sadly many including media often jump th…,"Sentiment(polarity=0.16666666666666666, subjectivity=0.8333333333333334)",0.16666666666666666,0.8333333333333334,en,0,15,drakishl,False,,OutbreakJake,London,
1243844961155584000,Sat Mar 28 10:18:42 +0000 2020,"<a href=""http://twitter.com/download/iphone"" rel=""nofollow"">Twitter for iPhone</a>",“The #Coronavirus Is Prompting Middle East Regimes to Release Prisoners. But Journalists and Activists Remain Behin… https://t.co/C1yZBA7u5s,“ The Is Prompting Middle East Regimes Release Prisoners But Journalists Activists Remain Behin…,"Sentiment(polarity=0.0, subjectivity=0.0)",0.0,0.0,en,0,276,RSF_en,False,Coronavirus,,,
1243844957200199680,Sat Mar 28 10:18:41 +0000 2020,"<a href=""https://mobile.twitter.com"" rel=""nofollow"">Twitter Web App</a>",RT @TheHansIndiaWeb: Chittoor sanitary workers take oath for not apply leave till April 15 #SanitaryWorkers #ChittoorMunicipalCorporation #…,Chittoor sanitary workers take oath apply leave till April …,"Sentiment(polarity=0.0, subjectivity=0.0)",0.0,0.0,en,0,2765,luckytanlucky,,"SanitaryWorkers, ChittoorMunicipalCorporation",TheHansIndiaWeb,"Nuzvid, Andhra Pradesh",
1243844952804610049,Sat Mar 28 10:18:40 +0000 2020,"<a href=""https://mobile.twitter.com"" rel=""nofollow"">Twitter Web App</a>","The ferry service will cease after today, until further notice. We are closely monitoring the global and national s… https://t.co/oN47Vcznar",The ferry service cease today notice We closely monitoring global national s…,"Sentiment(polarity=0.0, subjectivity=0.0)",0.0,0.0,en,0,21115,AranIslandFerry,,,,"Galway, Ireland",
1243844948882939906,Sat Mar 28 10:18:39 +0000 2020,"<a href=""http://twitter.com/download/android"" rel=""nofollow"">Twitter for Android</a>","RT @PhilstarNews: BREAKING: The Philippines now has more than 1,000 cases of #COVID19PH after the Department of Health reported 272 new cas…","BREAKING The Philippines ,000 cases Department Health reported new cas…","Sentiment(polarity=0.13636363636363635, subjectivity=0.45454545454545453)",0.13636363636363635,0.45454545454545453,en,0,0,smilekrystals,,COVID19PH,PhilstarNews,,
1243844944596316160,Sat Mar 28 10:18:38 +0000 2020,"<a href=""http://twitter.com/download/android"" rel=""nofollow"">Twitter for Android</a>","RT @moreki_mo: I swear we are fighting two pandemics 
Covid 19 and Stupidity",I swear fighting two pandemics Covid Stupidity,"Sentiment(polarity=-0.6, subjectivity=1.0)",-0.6,1.0,en,0,426,alizarinnn,,,moreki_mo,myalizarin.wordpress.com,
1243844940523655168,Sat Mar 28 10:18:37 +0000 2020,"<a href=""https://mobile.twitter.com"" rel=""nofollow"">Twitter Web App</a>","Compelling think piece by @rupasubramanya on the economic and human cost of the coronavirus lockdown, and how we ma… https://t.co/r5ZEgLQ5Cv",Compelling think piece economic human cost coronavirus lockdown ma…,"Sentiment(polarity=0.16666666666666666, subjectivity=0.3)",0.16666666666666666,0.3,en,0,261,VivanMarwaha,False,,rupasubramanya,"New Delhi / Washington, DC",
1243844936098664448,Sat Mar 28 10:18:36 +0000 2020,"<a href=""http://twitter.com/download/android"" rel=""nofollow"">Twitter for Android</a>","RT @ScottGottliebMD: This is GAME CHANGER. Abbott to market, starting next week, a fast point-of-care #coronavirus test, delivering positiv…",This GAME CHANGER Abbott market starting next week fast point-of-care test delivering positiv…,"Sentiment(polarity=-0.05, subjectivity=0.275)",-0.05,0.275,en,0,76394,arunkumar_bvr,,coronavirus,ScottGottliebMD,India,
1243844932126666752,Sat Mar 28 10:18:35 +0000 2020,"<a href=""http://twitter.com/download/android"" rel=""nofollow"">Twitter for Android</a>","RT @ChicagoTraderrr: I lost my Dad this morning to COVID-19. He was my rock, my best friend, and my hero. He had virtually no symptoms and…",I lost Dad morning COVID-19 He rock best friend hero He virtually symptoms and…,"Sentiment(polarity=1.0, subjectivity=0.3)",1.0,0.3,en,0,1204,lvrangela,,,ChicagoTraderrr,afg,
1243844927924166656,Sat Mar 28 10:18:34 +0000 2020,"<a href=""http://twitter.com/download/android"" rel=""nofollow"">Twitter for Android</a>",RT @RugbyReg: This could be the video that very much defines COVID 19 in years to come.,This could video much defines COVID years come,"Sentiment(polarity=0.2, subjectivity=0.2)",0.2,0.2,en,0,76406,object_000,,,RugbyReg,Bristol,
1243844923721318400,Sat Mar 28 10:18:33 +0000 2020,"<a href=""https://mobile.twitter.com"" rel=""nofollow"">Twitter Web App</a>",RT @MichaelCoudrey: BREAKING: French government reverses earlier ban on hydroxychloroquine for treating COVID19 patients in light of succes…,BREAKING French government reverses earlier ban hydroxychloroquine treating COVID19 patients light succes…,"Sentiment(polarity=0.13333333333333333, subjectivity=0.39999999999999997)",0.13333333333333333,0.39999999999999997,en,0,10,DoghliDuniya,,,MichaelCoudrey,India,
1243844919153831936,Sat Mar 28 10:18:32 +0000 2020,"<a href=""http://twitter.com/download/android"" rel=""nofollow"">Twitter for Android</a>",RT @AmaleeAmin: A useful piece on steps for a post #COVID19 recovery  https://t.co/Y3XxGC4iuN @MLiebreich,A useful piece steps post recovery,"Sentiment(polarity=0.3, subjectivity=0.0)",0.3,0.0,en,0,273,JasonSchaffler,False,COVID19,"AmaleeAmin, MLiebreich",,
