id,created_at,source,original_text,clean_text,sentiment,polarity,subjectivity,lang,favorite_count,retweet_count,original_author,possibly_sensitive,hashtags,user_mentions,place,place_coord_boundaries
1243665735521415168,Fri Mar 27 22:26:32 +0000 2020,"<a href=""http://twitter.com/download/android"" rel=""nofollow"">Twitter for Android</a>","RT @moreki_mo: I swear we are fighting two pandemics 
Covid 19 and Stupidity",I swear fighting two pandemics Covid Stupidity,"Sentiment(polarity=-0.6, subjectivity=1.0)",-0.6,1.0,en,0,0,SupremeBrina,,,moreki_mo,,
1243665734636535809,Fri Mar 27 22:26:31 +0000 2020,"<a href=""http://twitter.com/download/iphone"" rel=""nofollow"">Twitter for iPhone</a>",RT @WHO: Media briefing on #COVID19 with @DrTedros. #coronavirus https://t.co/VDzh2GSuPM,Media briefing,"Sentiment(polarity=0.0, subjectivity=0.0)",0.0,0.0,en,0,387,BlindRamblings,False,"COVID19, coronavirus","WHO, DrTedros",,
1243665730471702529,Fri Mar 27 22:26:30 +0000 2020,"<a href=""https://mobile.twitter.com"" rel=""nofollow"">Twitter Web App</a>","There isn’t a need to be delicate about the translated message. Our mob in the bush are the most vulnerable, so it… https://t.co/85RPVyR7wj",There ’ need delicate translated message Our mob bush vulnerable it…,"Sentiment(polarity=-0.4, subjectivity=0.7)",-0.4,0.7,en,0,1141,joel_perrurle,False,,,Tyuretye - Alice Springs. ,
1243665726289801216,Fri Mar 27 22:26:29 +0000 2020,"<a href=""http://twitter.com/download/iphone"" rel=""nofollow"">Twitter for iPhone</a>","RT @gringatears: This is 100% true! I work for a bank and worked for different call centers, you HAVE to state that you’ve been affected by…",This true I work bank worked different call centers HAVE state ’ affected by…,"Sentiment(polarity=0.175, subjectivity=0.625)",0.175,0.625,en,0,0,withteethbared,,,gringatears,,
1243665722083102720,Fri Mar 27 22:26:28 +0000 2020,"<a href=""http://twitter.com/download/android"" rel=""nofollow"">Twitter for Android</a>",RT @noelhimself: BREAKING NEWS: Burundi is the only African country without any case of coronavirus. When the Minister Of Health was asked…,BREAKING NEWS Burundi African country without case coronavirus When Minister Of Health asked…,"Sentiment(polarity=0.0, subjectivity=0.0)",0.0,0.0,en,0,0,RHanasong,,,noelhimself,,
1243665717679046657,Fri Mar 27 22:26:27 +0000 2020,"<a href=""http://twitter.com/download/android"" rel=""nofollow"">Twitter for Android</a>","I can't believe y'all President is saying these Governors need to be more appreciative. Seriously?!?!?!?

#COVID19… https://t.co/4OMITeEgkv",I ca n't believe y'all President saying Governors need appreciative Seriously …,"Sentiment(polarity=0.13333333333333333, subjectivity=0.7833333333333333)",0.13333333333333333,0.7833333333333333,en,0,20,TGirlIF,False,COVID19,,,
1243665713597947904,Fri Mar 27 22:26:26 +0000 2020,"<a href=""http://twitter.com/download/android"" rel=""nofollow"">Twitter for Android</a>","RT @gladinfinitum: @Complex What’s he worried about, it’s covid-19. Too old for him",What ’ worried ’ covid-19 Too old,"Sentiment(polarity=0.1, subjectivity=0.2)",0.1,0.2,en,0,1504,itszeynabbb,,,"gladinfinitum, Complex",🇵🇰🇦🇪🇨🇿,
1243665709491802112,Fri Mar 27 22:26:25 +0000 2020,"<a href=""http://twitter.com/download/android"" rel=""nofollow"">Twitter for Android</a>","RT @newvisionwire: JUST IN: 5 New #coronavirus cases confirmed 

MOH has confirmed 5 new cases of #COVID19UG  bringing the total to 23 case…",JUST IN New cases confirmed MOH confirmed new cases bringing total case…,"Sentiment(polarity=0.21454545454545454, subjectivity=0.7318181818181818)",0.21454545454545454,0.7318181818181818,en,0,103778,mukamezra,,"coronavirus, COVID19UG",newvisionwire,kigali Rwanda,
1243665705138098183,Fri Mar 27 22:26:24 +0000 2020,"<a href=""http://twitter.com/download/iphone"" rel=""nofollow"">Twitter for iPhone</a>","RT @w_terrence: NO DEMOCRATS WERE INVITED 😂

People are very upset that President @realDonaldTrump didn’t invite any democrats at the #coro…",NO DEMOCRATS WERE INVITED People upset President ’ invite democrats …,"Sentiment(polarity=0.0, subjectivity=0.0)",0.0,0.0,en,0,14,frank_negron,,,"w_terrence, realDonaldTrump","Kissimmee, FL",
1243665700972945408,Fri Mar 27 22:26:23 +0000 2020,"<a href=""http://twitter.com/download/iphone"" rel=""nofollow"">Twitter for iPhone</a>",RT @WeberCounty: 📞👇🏻 Your Weber County Commissioners and team been calling EVERY single business (all 130+ of them!) who responded to our s…,Your Weber County Commissioners team calling EVERY single business responded s…,"Sentiment(polarity=-0.07142857142857142, subjectivity=0.21428571428571427)",-0.07142857142857142,0.21428571428571427,en,0,0,MissileWells,,,WeberCounty,,
1243665696892092422,Fri Mar 27 22:26:22 +0000 2020,"<a href=""http://twitter.com/download/iphone"" rel=""nofollow"">Twitter for iPhone</a>",RT @ChristinePolon1: COVID-19 Part 2 The Fall Cabal. Bioengineered pandemic. Don't take the vaccine unless President Trump says it's okay.…,COVID-19 Part The Fall Cabal Bioengineered pandemic Do n't take vaccine unless President Trump says 's okay.…,"Sentiment(polarity=0.0, subjectivity=0.0)",0.0,0.0,en,0,308,X16Son,,,ChristinePolon1,,
1243665692571906049,Fri Mar 27 22:26:21 +0000 2020,"<a href=""http://twitter.com/download/android"" rel=""nofollow"">Twitter for Android</a>",RT @AnaCabrera: JUST IN: 51 Italian doctors who tested positive for #coronavirus have died - Italian Association of Doctors,JUST IN Italian doctors tested positive died Italian Association Doctors,"Sentiment(polarity=0.07575757575757576, subjectivity=0.1818181818181818)",0.07575757575757576,0.1818181818181818,en,0,0,kmoutaib,,coronavirus,AnaCabrera,Paris/Rabat,
1243665688398569478,Fri Mar 27 22:26:20 +0000 2020,"<a href=""http://twitter.com"" rel=""nofollow"">Twitter Web Client</a>","RT @gringatears: This is 100% true! I work for a bank and worked for different call centers, you HAVE to state that you’ve been affected by…",This true I work bank worked different call centers HAVE state ’ affected by…,"Sentiment(polarity=0.175, subjectivity=0.625)",0.175,0.625,en,0,0,GregIradel,,,gringatears,,
1243665684313358338,Fri Mar 27 22:26:19 +0000 2020,"<a href=""http://twitter.com/download/android"" rel=""nofollow"">Twitter for Android</a>","RT @gringatears: This is 100% true! I work for a bank and worked for different call centers, you HAVE to state that you’ve been affected by…",This true I work bank worked different call centers HAVE state ’ affected by…,"Sentiment(polarity=0.175, subjectivity=0.625)",0.175,0.625,en,0,0,XdizzleWasTaken,,,gringatears,Somewhere only we know,
1243665680022384641,Fri Mar 27 22:26:18 +0000 2020,"<a href=""http://twitter.com/download/iphone"" rel=""nofollow"">Twitter for iPhone</a>",RT @abc7newsbayarea: California Gov. Gavin Newsom issued an executive order on Friday banning the eviction of renters who are affected by C…,California Gov Gavin Newsom issued executive order Friday banning eviction renters affected C…,"Sentiment(polarity=0.0, subjectivity=0.0)",0.0,0.0,en,0,744,magafato,,,abc7newsbayarea,"San Jose, CA",
1243665675849043969,Fri Mar 27 22:26:17 +0000 2020,"<a href=""http://twitter.com/#!/download/ipad"" rel=""nofollow"">Twitter for iPad</a>","@dougducey With all due respect, Governor, WE DON’T KNOW WHO HAS COVID-19 BECAUSE WE ARE LAST IN THE COUNTRY ON TES… https://t.co/wyl4rpkV8A",With due respect Governor WE DON ’ T KNOW WHO HAS COVID-19 BECAUSE WE ARE LAST IN THE COUNTRY ON TES…,"Sentiment(polarity=-0.0625, subjectivity=0.22083333333333333)",-0.0625,0.22083333333333333,en,0,14,mnellwood,,,dougducey,Tucson AZ,
1243665671726170113,Fri Mar 27 22:26:16 +0000 2020,"<a href=""http://twitter.com/download/iphone"" rel=""nofollow"">Twitter for iPhone</a>","RT @ACNHCentral: Because we are all dealing with the #coronavirus, I thought I’d spread some positivity!! ❤️✨

I’m giving one person that r…",Because dealing I thought I ’ spread positivity ️ I ’ giving one person r…,"Sentiment(polarity=0.0, subjectivity=0.0)",0.0,0.0,en,0,20,sonnyisbitter,,coronavirus,ACNHCentral,,
1243665667112329216,Fri Mar 27 22:26:15 +0000 2020,"<a href=""https://mobile.twitter.com"" rel=""nofollow"">Twitter Web App</a>","We go from climate change to drought to bushfires to covid 19 Corona virus they our new season  not, Summer Winter… https://t.co/aS21ITlYpo",We go climate change drought bushfires covid Corona virus new season Summer Winter…,"Sentiment(polarity=0.13636363636363635, subjectivity=0.45454545454545453)",0.13636363636363635,0.45454545454545453,en,0,37,damneat2110,False,,,GOMEROI,
1243665663144722432,Fri Mar 27 22:26:14 +0000 2020,"<a href=""http://twitter.com/download/iphone"" rel=""nofollow"">Twitter for iPhone</a>",RT @GamingGifter: #CoronaLockdown is happening all around the world. To make someone’s day &amp; spread some positivity during in this dreadful…,happening around world To make someone ’ day amp spread positivity dreadful…,"Sentiment(polarity=0.0, subjectivity=0.0)",0.0,0.0,en,0,4931,SeagullNumber5,,CoronaLockdown,GamingGifter,"Kentucky, USA",
1243665659134971911,Fri Mar 27 22:26:13 +0000 2020,"<a href=""http://twitter.com/download/iphone"" rel=""nofollow"">Twitter for iPhone</a>","RT @RT_com: BREAKING: #Trump greenlights call-up of one MILLION reservists to battle Covid-19 

https://t.co/vIVEBtaJuq https://t.co/k7qOAQ…",BREAKING greenlights call-up one MILLION reservists battle Covid-19,"Sentiment(polarity=0.0, subjectivity=0.0)",0.0,0.0,en,0,0,Paulmatt8400,False,Trump,RT_com,"Austin,Tx",
1243665654982545410,Fri Mar 27 22:26:12 +0000 2020,"<a href=""http://twitter.com/download/android"" rel=""nofollow"">Twitter for Android</a>","RT @donahuejm: A NY Senate Bill proposes a 90-day rent suspension, small galleries have ignored requests for negotiations during their clos…",A NY Senate Bill proposes -day rent suspension small galleries ignored requests negotiations clos…,"Sentiment(polarity=-0.25, subjectivity=0.4)",-0.25,0.4,en,0,9540,cegeterie8,,,donahuejm,,
1243665650754531328,Fri Mar 27 22:26:11 +0000 2020,"<a href=""http://twitter.com/download/android"" rel=""nofollow"">Twitter for Android</a>","RT @MinofHealthUG: 5 new cases of COVID-19 confirmed bringing the total to 23 cases in Uganda. Out of 227 samples run today at @UVRIug, 222…",new cases COVID-19 confirmed bringing total cases Uganda Out samples run today …,"Sentiment(polarity=0.1787878787878788, subjectivity=0.7348484848484849)",0.1787878787878788,0.7348484848484849,en,0,314,ethanimubiru,,,"MinofHealthUG, UVRIug","Kampala, Uganda",
1243665646530916352,Fri Mar 27 22:26:10 +0000 2020,"<a href=""http://twitter.com/download/android"" rel=""nofollow"">Twitter for Android</a>",RT @Memej99: Pls help donate 2 the @SCDAAorg so that #SickleCell patients &amp; families in need can get essentials they need during #COVID19.…,Pls help donate patients amp families need get essentials need .…,"Sentiment(polarity=0.0, subjectivity=0.0)",0.0,0.0,en,0,175,TheDarkGift_,,"SickleCell, COVID19","Memej99, SCDAAorg",,
1243665642206756869,Fri Mar 27 22:26:09 +0000 2020,"<a href=""http://twitter.com/download/android"" rel=""nofollow"">Twitter for Android</a>","RT @yiyoungvoices: Live now: #YMCA youth advocates with 
@CarloSanvee
  share how #Covid19 #Coronavirus is affecting us all globally and id…",Live youth advocates share affecting us globally id…,"Sentiment(polarity=0.06818181818181818, subjectivity=0.25)",0.06818181818181818,0.25,en,0,9545,TalksWild,,"YMCA, Covid19, Coronavirus","yiyoungvoices, carloSanvee",,
1243665638188634117,Fri Mar 27 22:26:08 +0000 2020,"<a href=""http://twitter.com/download/android"" rel=""nofollow"">Twitter for Android</a>",RT @MONBEBEnt: Don't forget! Monsta X will be in tomorrows Twitch livestream to raise funds to battle COVID-19. If you have any extra $ you…,Do n't forget Monsta X tomorrows Twitch livestream raise funds battle COVID-19 If extra you…,"Sentiment(polarity=0.0, subjectivity=0.1)",0.0,0.1,en,0,16166,MonbebePolska,,,MONBEBEnt,,
1243665633939558402,Fri Mar 27 22:26:07 +0000 2020,"<a href=""http://twitter.com/download/iphone"" rel=""nofollow"">Twitter for iPhone</a>",@JoeBiden And what’s Andrew Cuomo’s excuse. He’s letting New Yorkers flee the city taking covid-19 to god knows where.,And ’ Andrew Cuomo ’ excuse He ’ letting New Yorkers flee city taking covid-19 god knows,"Sentiment(polarity=0.043181818181818175, subjectivity=0.25227272727272726)",0.043181818181818175,0.25227272727272726,en,0,4088,cjdobbs1,,,JoeBiden,"Fort Worth, TX",
1243665629766443011,Fri Mar 27 22:26:06 +0000 2020,"<a href=""http://twitter.com/download/android"" rel=""nofollow"">Twitter for Android</a>","RT @jpuopolo: Wow @realDonaldTrump basically just said the biggest faults of state governors are that they aren't appreciative enough.  

#…",Wow basically said biggest faults state governors n't appreciative enough …,"Sentiment(polarity=0.2333333333333333, subjectivity=0.7999999999999999)",0.2333333333333333,0.7999999999999999,en,0,103835,blushooz1920,,,"jpuopolo, realDonaldTrump",Ouchea,
1243665625605476352,Fri Mar 27 22:26:05 +0000 2020,"<a href=""http://twitter.com"" rel=""nofollow"">Twitter Web Client</a>","2020 air cargo volume may drop 20%, IATA says, while Airfreight rates continue to rise as capacity remains tight du… https://t.co/RrdO0V6JJ3",air cargo volume may drop IATA says Airfreight rates continue rise capacity remains tight du…,"Sentiment(polarity=-0.17857142857142858, subjectivity=0.2857142857142857)",-0.17857142857142858,0.2857142857142857,en,0,2,RedArrow3PL,False,,,"Bellevue, Washington",
1243665621352669185,Fri Mar 27 22:26:04 +0000 2020,"<a href=""http://twitter.com/download/android"" rel=""nofollow"">Twitter for Android</a>","RT @channelstv: BREAKING: Davido Goes Into Self-Isolation As Fiancée, Chioma Tests Positive For COVID-19
https://t.co/jpjM6Hgya4 https://t.…",BREAKING Davido Goes Into Self-Isolation As Fiancée Chioma Tests Positive For COVID-19,"Sentiment(polarity=0.22727272727272727, subjectivity=0.5454545454545454)",0.22727272727272727,0.5454545454545454,en,0,0,Olawaletimoth14,False,,channelstv,Nigeria,
1243665617120616448,Fri Mar 27 22:26:03 +0000 2020,"<a href=""http://twitter.com/download/iphone"" rel=""nofollow"">Twitter for iPhone</a>",RT @DrLaPook: Tonight on @CBSEveningNews: how a blood test looking for evidence of immunity to #COVID19 could lead to a new treatment PLUS…,Tonight blood test looking evidence immunity could lead new treatment PLUS…,"Sentiment(polarity=0.13636363636363635, subjectivity=0.45454545454545453)",0.13636363636363635,0.45454545454545453,en,0,15,AnneLaBarbera,,COVID19,"DrLaPook, CBSEveningNews","New York, NY",
1243665613056286720,Fri Mar 27 22:26:02 +0000 2020,"<a href=""http://twitter.com/download/iphone"" rel=""nofollow"">Twitter for iPhone</a>","RT @theworldindex: Coronavirus (COVID-19) deaths worldwide:

🇮🇹ITA: 9,134
🇪🇸ESP: 4,934
🇨🇳CHN: 3,292
🇮🇷IRI: 2,378
🇫🇷FRA: 1,995
🇺🇸USA: 1,477…","Coronavirus COVID-19 deaths worldwide 🇮🇹ITA ,134 🇪🇸ESP ,934 🇨🇳CHN ,292 🇮🇷IRI ,378 🇫🇷FRA ,995 🇺🇸USA ,477…","Sentiment(polarity=0.0, subjectivity=0.0)",0.0,0.0,en,0,0,27_amazon,,,theworldindex,,
1243665608790638593,Fri Mar 27 22:26:01 +0000 2020,"<a href=""http://twitter.com/download/android"" rel=""nofollow"">Twitter for Android</a>","RT @w_terrence: NO DEMOCRATS WERE INVITED 😂

People are very upset that President @realDonaldTrump didn’t invite any democrats at the #coro…",NO DEMOCRATS WERE INVITED People upset President ’ invite democrats …,"Sentiment(polarity=0.0, subjectivity=0.0)",0.0,0.0,en,0,1,sonaroan,,,"w_terrence, realDonaldTrump","Highlands, Scotland, UK",
1243665604504178688,Fri Mar 27 22:26:00 +0000 2020,"<a href=""http://twitter.com/download/android"" rel=""nofollow"">Twitter for Android</a>","RT @BashirAhmaad: Like @NCDCGov’s 080097000010, most of our states have their own dedicated helplines to assist citizens on #coronavirus re…",Like ’ states dedicated helplines assist citizens re…,"Sentiment(polarity=0.0, subjectivity=0.0)",0.0,0.0,en,0,28,Muhaytu,,coronavirus,"BashirAhmaad, NCDCgov",On Earth☺ ,
1243665600372707334,Fri Mar 27 22:25:59 +0000 2020,"<a href=""http://twitter.com/download/iphone"" rel=""nofollow"">Twitter for iPhone</a>",RT @mullrainee: So China kicks American news outlets out. The next day claims there are zero new COVID-19 cases in Wuhan and we’re just pre…,So China kicks American news outlets The next day claims zero new COVID-19 cases Wuhan ’ pre…,"Sentiment(polarity=0.04545454545454545, subjectivity=0.15151515151515152)",0.04545454545454545,0.15151515151515152,en,0,24,jaredgeng54,,,mullrainee,"Chesterton, IN",
1243665596249604097,Fri Mar 27 22:25:58 +0000 2020,"<a href=""https://mobile.twitter.com"" rel=""nofollow"">Twitter Web App</a>","RT @RepDougCollins: .@realDonaldTrump has never wavered in his approach to fighting #coronavirus.
 
He is working to put the health of Amer…",never wavered approach fighting He working put health Amer…,"Sentiment(polarity=0.0, subjectivity=0.0)",0.0,0.0,en,0,0,david_quinze,,coronavirus,"RepDougCollins, realDonaldTrump",,
1243665591979970560,Fri Mar 27 22:25:57 +0000 2020,"<a href=""https://mobile.twitter.com"" rel=""nofollow"">Twitter Web App</a>",RT @VsauceThree: Tracking COVID-19 and MORE! [NEW DONG] --&gt; https://t.co/bYULNtfXxO https://t.co/WLQhPxyn2z,Tracking COVID-19 MORE NEW DONG -- gt,"Sentiment(polarity=0.3181818181818182, subjectivity=0.4772727272727273)",0.3181818181818182,0.4772727272727273,en,0,0,Kurosaki9819,False,,VsauceThree,"Clermont-Ferrand, France",
1243665587852709888,Fri Mar 27 22:25:56 +0000 2020,"<a href=""https://mobile.twitter.com"" rel=""nofollow"">Twitter Web App</a>",Shame on you @POTUS you are a pathetic excuse for a leader #coronavirus,Shame pathetic excuse leader,"Sentiment(polarity=-0.525, subjectivity=0.525)",-0.525,0.525,en,0,2065,CriedTilLaughed,,coronavirus,POTUS,Hurricane Junction uh huh,
1243665583603924993,Fri Mar 27 22:25:55 +0000 2020,"<a href=""http://twitter.com/download/iphone"" rel=""nofollow"">Twitter for iPhone</a>","RT @moreki_mo: I swear we are fighting two pandemics 
Covid 19 and Stupidity",I swear fighting two pandemics Covid Stupidity,"Sentiment(polarity=-0.6, subjectivity=1.0)",-0.6,1.0,en,0,4,g0ldenchanel,,,moreki_mo,,
1243665579501854723,Fri Mar 27 22:25:54 +0000 2020,"<a href=""https://mobile.twitter.com"" rel=""nofollow"">Twitter Web App</a>",Terenz’s AI Engine detects COVID-19 from Chest X-Rays with an Accuracy of 98.14% by James S. https://t.co/Q8iaAfOtzG,Terenz ’ AI Engine detects COVID-19 Chest X-Rays Accuracy 4 James S,"Sentiment(polarity=0.0, subjectivity=0.0)",0.0,0.0,en,0,323,SoizicContin4,False,,,,
1243665575227899906,Fri Mar 27 22:25:53 +0000 2020,"<a href=""https://mobile.twitter.com"" rel=""nofollow"">Twitter Web App</a>","RT @Mohaddessin: #Iran: #Coronavirus death toll reaches 8,200 in 200 cities
#Covid_19 
https://t.co/uLMWwauqEA","death toll reaches ,200 cities","Sentiment(polarity=0.0, subjectivity=0.0)",0.0,0.0,en,0,275,1Maesumeh1,False,"Iran, Coronavirus, Covid_19",Mohaddessin,,
1243665571075354624,Fri Mar 27 22:25:52 +0000 2020,"<a href=""http://twitter.com/download/iphone"" rel=""nofollow"">Twitter for iPhone</a>","RT @ExcitedLeigh: My bank: ""There is a scam involving a fake government SMS with a web link to info on where to get tested for COVID-19 whi…",My bank `` There scam involving fake government SMS web link info get tested COVID-19 whi…,"Sentiment(polarity=-0.5, subjectivity=1.0)",-0.5,1.0,en,0,126,FaeHerself,,,ExcitedLeigh,"West Ryde, Sydney",
1243665566688215042,Fri Mar 27 22:25:51 +0000 2020,"<a href=""http://twitter.com/#!/download/ipad"" rel=""nofollow"">Twitter for iPad</a>","RT @dublinactivist: Why France Is Hiding A Cheap &amp; Tested Virus Cure
Incredible corruption &amp; collusion between #MacronsGovt &amp; #BigPharma 
M…",Why France Is Hiding A Cheap amp Tested Virus Cure Incredible corruption amp collusion amp M…,"Sentiment(polarity=0.65, subjectivity=0.8)",0.65,0.8,en,0,21,ExCatho,,"MacronsGovt, BigPharma",dublinactivist,derrière la sacristie,
1243665562586267656,Fri Mar 27 22:25:50 +0000 2020,"<a href=""http://twitter.com/download/android"" rel=""nofollow"">Twitter for Android</a>","RT @JonathanMerritt: I don’t often ask for prayer on here, but my friend Laura from NYC has COVID-19. She has double pneumonia and is in IC…",I ’ often ask prayer friend Laura NYC COVID-19 She double pneumonia IC…,"Sentiment(polarity=0.0, subjectivity=0.0)",0.0,0.0,en,0,422,PcolaBucsfan,,,JonathanMerritt,"Pensacola, FL",
1243665558517747712,Fri Mar 27 22:25:49 +0000 2020,"<a href=""http://twitter.com/download/android"" rel=""nofollow"">Twitter for Android</a>",RT @AnaCabrera: JUST IN: 51 Italian doctors who tested positive for #coronavirus have died - Italian Association of Doctors,JUST IN Italian doctors tested positive died Italian Association Doctors,"Sentiment(polarity=0.07575757575757576, subjectivity=0.1818181818181818)",0.07575757575757576,0.1818181818181818,en,0,24896,sleepkeeper,,coronavirus,AnaCabrera,,
1243665554294149121,Fri Mar 27 22:25:48 +0000 2020,"<a href=""http://twitter.com/download/iphone"" rel=""nofollow"">Twitter for iPhone</a>",RT @doctor_oxford: Truly heartbreaking. The first teenager in America to die of #COVID19 - a 17 year old boy from California - was denied c…,Truly heartbreaking The first teenager America die year old boy California denied c…,"Sentiment(polarity=0.175, subjectivity=0.26666666666666666)",0.175,0.26666666666666666,en,0,103888,FurnessGirl,,COVID19,doctor_oxford,South Cumbria,
1243665550137536513,Fri Mar 27 22:25:47 +0000 2020,"<a href=""http://twitter.com/download/iphone"" rel=""nofollow"">Twitter for iPhone</a>","RT @Mixana_PaBlo: I washed my hands so much due to COVID 19, that my exam notes from 2007 resurfaced",I washed hands much due COVID exam notes resurfaced,"Sentiment(polarity=-0.125, subjectivity=0.375)",-0.125,0.375,en,0,9559,amandasosaucy,,,Mixana_PaBlo,,
1243665545934839811,Fri Mar 27 22:25:46 +0000 2020,"<a href=""http://twitter.com/download/android"" rel=""nofollow"">Twitter for Android</a>","Hmmm... two distinct strains, perhaps?  

#CoronaLockdown
#COVID19
#coronavirus
#CCPVirus
#escapedfromlab

https://t.co/ToDK80Zvin",Hmmm ... two distinct strains perhaps,"Sentiment(polarity=0.3, subjectivity=0.3)",0.3,0.3,en,0,27,capac_manco,False,"CoronaLockdown, COVID19, coronavirus, CCPVirus, escapedfromlab",,"Virginia, USA",
1243665541455327235,Fri Mar 27 22:25:45 +0000 2020,"<a href=""https://mobile.twitter.com"" rel=""nofollow"">Twitter Web App</a>","RT @derekjames150: Do you remember when #DonaldTrump called #Coronavirus a ""hoax"". It's hard to believe there are still people who want to…",Do remember called `` hoax '' It 's hard believe still people want to…,"Sentiment(polarity=-0.2916666666666667, subjectivity=0.5416666666666666)",-0.2916666666666667,0.5416666666666666,en,0,1738,rgculley,,"DonaldTrump, Coronavirus",derekjames150,"Doncaster, UK",
1243665537487470594,Fri Mar 27 22:25:44 +0000 2020,"<a href=""https://mobile.twitter.com"" rel=""nofollow"">Twitter Web App</a>","RT @Condor_Law: @Acosta #FakeNewsCNN: “The USA has the highest number of #coronavirus cases in the world!”

#FactCheck:
The USA has
The hig…",“ The USA highest number cases world ” The USA The hig…,"Sentiment(polarity=0.0, subjectivity=0.0)",0.0,0.0,en,0,21,Atkins1S,,"FakeNewsCNN, coronavirus, FactCheck","Condor_Law, Acosta",In aboat ona riverof Dreams Co,
1243665533347581952,Fri Mar 27 22:25:43 +0000 2020,"<a href=""https://mobile.twitter.com"" rel=""nofollow"">Twitter Web App</a>",RT @StevenTDennis: Johns Hopkins count has USA topping 100K cases of COVID-19,Johns Hopkins count USA topping K cases COVID-19,"Sentiment(polarity=0.0, subjectivity=0.0)",0.0,0.0,en,0,2,SofiaGrimsgard,,,StevenTDennis,"New York, NY",
1243665529077764096,Fri Mar 27 22:25:42 +0000 2020,"<a href=""http://twitter.com/download/iphone"" rel=""nofollow"">Twitter for iPhone</a>",RT @CBCTheNational: #AtIssue: Did the Liberal government overreach with a proposed bill to broadly tax and spend without parliamentary appr…,Did Liberal government overreach proposed bill broadly tax spend without parliamentary appr…,"Sentiment(polarity=0.0625, subjectivity=0.3125)",0.0625,0.3125,en,0,103909,edwardtbarnes1,,AtIssue,CBCTheNational,,
1243665524875280385,Fri Mar 27 22:25:41 +0000 2020,"<a href=""http://twitter.com/download/android"" rel=""nofollow"">Twitter for Android</a>","RT @Julius_S_Malema: ”Due to limited resources to combat the Covid-19 Pandemic in world, we have created this App (Tool) for everyone to be…",” Due limited resources combat Covid-19 Pandemic world created App Tool everyone be…,"Sentiment(polarity=-0.09821428571428571, subjectivity=0.2589285714285714)",-0.09821428571428571,0.2589285714285714,en,0,41,Asemahle_19,,,Julius_S_Malema,South Africa,
1243665520781475840,Fri Mar 27 22:25:40 +0000 2020,"<a href=""http://twitter.com/download/iphone"" rel=""nofollow"">Twitter for iPhone</a>","RT @KissMeCole: Costco employees are testing positive for Covid-19. . . Costco, where hundreds of people go weekly to get “essentials.” Now…",Costco employees testing positive Covid-19 Costco hundreds people go weekly get “ essentials. ” Now…,"Sentiment(polarity=0.22727272727272727, subjectivity=0.5454545454545454)",0.22727272727272727,0.5454545454545454,en,0,1306,yvonnethejiraf,,,KissMeCole,"Arizona, USA",
